institution,type,doi,photo_article_title,photo_journal_title,photo_journal_volume,photo_journal_issue,photo_journal_year,photo_journal_inclusive_pages,photo_article_author,transaction_status,transaction_date,issn,base_fee,lending_library,reason_for_cancellation,call_number,location,maxcost,document_type,system_id,ifm_cost,copyright_payment_method,ccc_number,copyright_comp,article_title,journal_title,volume,issue,year,pages,article_author,x_1,cited_in,creation_date,photo_item_publisher,notes_on_access,notes,randon_number_generator,journal_volume,journal_issue,journal_year,journal_inclusive_pages,status,doi_input,doi_present,oabutton_query,oabutton_queryname,oabutton_match,oabutton_url,oabutton_type,oabutton_source,oabutton_title,oabutton_oa_result
pacific,lending,10.1086/690218,NA,NA,NA,NA,NA,NA,NA,Request Finished,42866.566740277776,0003-0147,NA,NA,NA,NA,NA,NA,NA,OCLC,NA,NA,NA,NA,From Individual to Group Territoriality: Competitive Environments Promote the Evolution of Sociality,The American naturalist.,189,3,03/2017,E46-E57,"Essex Institute; American Society of Naturalists Markus Port, Oliver Schülke, Julia Ostner",NA,"Salem, Mass. : Essex Institute, 1868-",42866.5424366088,"Salem, Mass. : Essex Institute, 1868-",NA,NA,NA,NA,NA,NA,NA,NA,10.1086/690218,1,10.1086/690218,doi,https://doi.org/10.1086/690218,NA,NA,NA,NA,oa_not_found
pacific,lending,10.1093/clipsy.6.1.6,NA,NA,NA,NA,NA,NA,NA,Request Finished,42774.643669826386,0969-5893,NA,NA,NA,NA,NA,NA,NA,OCLC,NA,NA,NA,NA,Emotionally focused couples therapy: Status and challenges.,Clinical psychology : a publication of the Division of Clinical Psychology of the American Psychological Association.,6,1,n/a 1999,67-79,"Johnson, Susan M.,",NA,"New York, NY : Published for the Division of Clinical Psychology of the American Psychological Association by Oxford University Press, ©1994-",42774.48654679398,"New York, NY : Published for the Divisio",NA,NA,NA,NA,NA,NA,NA,NA,10.1093/clipsy.6.1.6,1,10.1093/clipsy.6.1.6,doi,https://doi.org/10.1093/clipsy.6.1.6,NA,NA,NA,NA,oa_not_found
pacific,lending,10.1097/01.JHQ.0000460123.91061.b3,NA,NA,NA,NA,NA,NA,NA,Request Finished,42902.8424108449,1062-2551,NA,NA,NA,NA,NA,NA,NA,DOC,NA,NA,NA,NA,A standard handoff improves cardiac surgical patient transfe,Journal for healthcare quality : official publication of the National Association for Healthcare Qua,37,1,2015,22-32,Dixon JL;Stagg HW;Wehbe-Janek H;Jo C;Culp WC Jr;Shake JG,NA,NA,42902.81854008102,National Association For Healthcare Qual,NA,NA,NA,NA,NA,NA,NA,NA,10.1097/01.JHQ.0000460123.91061.b3,1,10.1097/01.JHQ.0000460123.91061.b3,doi,https://doi.org/10.1097/01.JHQ.0000460123.91061.b3,NA,NA,NA,NA,oa_not_found
pacific,lending,10.1097/01.phm.0000228577.56572.d6,NA,NA,NA,NA,NA,NA,NA,Request Finished,42793.498011655094,2331-2998,NA,NA,NA,NA,NA,NA,NA,OCLC,NA,NA,NA,NA,Short-Term Outcome of Conservative Treatment in Athletes with Symptomatic Lumbar Disc Herniation.,American journal of physical medicine.,85,8,2006,667-674,"Iwamoto,",NA,"Baltimore : Williams & Wilkins, 1952-1987.",42793.02862040509,"Baltimore : Williams & Wilkins, 1952-198",NA,NA,NA,NA,NA,NA,NA,NA,10.1097/01.phm.0000228577.56572.d6,1,10.1097/01.phm.0000228577.56572.d6,doi,https://doi.org/10.1097/01.phm.0000228577.56572.d6,NA,NA,NA,NA,oa_not_found
pacific,lending,10.1097/BCO.0000000000000058,NA,NA,NA,NA,NA,NA,NA,Request Finished,42786.458235300925,1940-7041,NA,NA,NA,NA,NA,NA,NA,OCLC,NA,NA,NA,NA,Reflections on the healthcare crisis.,Current Orthopaedic Practice.,25,1,1/1/2014,1-2,"Sarmiento, A.",NA,"Philadelphia : Lippincott, Wilkins & Williams.",42786.44926929398,"Philadelphia : Lippincott, Wilkins & Wil",NA,NA,NA,NA,NA,NA,NA,NA,10.1097/BCO.0000000000000058,1,10.1097/BCO.0000000000000058,doi,https://doi.org/10.1097/BCO.0000000000000058,NA,NA,NA,NA,oa_not_found
pacific,lending,10.1097/BPO.0000000000000849,NA,NA,NA,NA,NA,NA,NA,Request Finished,42660.67979579861,NA,NA,NA,NA,NA,NA,NA,NA,OCLC,NA,NA,NA,NA,Pediatric Injuries at an Annual Motocross Competition: Rates and Severity.,Journal of pediatric orthopedics.,Epub,NA,September 2016,unknown- ePub ahead of print,NA,NA,"New York, N.Y. : Raven Press",42660.43488854166,"New York, N.Y. : Raven Press",NA,NA,NA,NA,NA,NA,NA,NA,10.1097/BPO.0000000000000849,1,10.1097/BPO.0000000000000849,doi,https://doi.org/10.1097/BPO.0000000000000849,NA,NA,NA,NA,oa_not_found
pacific,lending,10.1097/DBP.0000000000000306,NA,NA,NA,NA,NA,NA,NA,Request Finished,42585.74161412037,1536-7312,NA,NA,NA,NA,NA,NA,NA,OCLC,NA,NA,NA,NA,Building Developmental-Behavioral Pediatrics in Low-Middle Income Countries Through International Collaboration,Journal of developmental & behavioral pediatrics.,37,6,2016,508-510,"Soares, Neelkamal S.",NA,"Baltimore, MD : Lippincott, Williams & Wilkins",42585.73437619213,"Baltimore, MD : Lippincott, Williams & W",NA,NA,NA,NA,NA,NA,NA,NA,10.1097/DBP.0000000000000306,1,10.1097/DBP.0000000000000306,doi,https://doi.org/10.1097/DBP.0000000000000306,NA,NA,NA,NA,oa_not_found
pacific,lending,10.1097/HCM.0000000000000043,NA,NA,NA,NA,NA,NA,NA,Request Finished,42578.483436689814,1525-5794 1550-512X,NA,NA,NA,NA,NA,NA,NA,OCLC,NA,NA,NA,NA,Nursing leaders' perceptions of a transition support program for new nurse graduates,The health care manager.,34,1,2015-02-06,14-22,"D'Addona, M.;Pinto, J.;Lavoie-Tremblay, M.;Oliver, C.;Turcotte, S.",NA,"Frederick, MD : Aspen Publishers, ©1999-",42578.45850008102,"Frederick, MD : Aspen Publishers, ©1999-",NA,NA,NA,NA,NA,NA,NA,NA,10.1097/HCM.0000000000000043,1,10.1097/HCM.0000000000000043,doi,https://doi.org/10.1097/HCM.0000000000000043,NA,NA,NA,NA,oa_not_found
pacific,lending,10.1097/HCM.0000000000000060,NA,NA,NA,NA,NA,NA,NA,Request Finished,42823.94674421296,1525-5794; 1550-512X,NA,NA,NA,NA,NA,NA,NA,OCLC,NA,NA,NA,NA,Health care leader competencies and the relevance of emotional intelligence.,The health care manager.,34,2,2015-04-01,140-146,Twila Weiszbrod,NA,"Frederick, MD : Aspen Publishers, ©1999-",42823.94327862268,"Frederick, MD : Aspen Publishers, ©1999-",NA,NA,NA,NA,NA,NA,NA,NA,10.1097/HCM.0000000000000060,1,10.1097/HCM.0000000000000060,doi,https://doi.org/10.1097/HCM.0000000000000060,NA,NA,NA,NA,oa_not_found
pacific,lending,10.1097/HRP.0000000000000100,NA,NA,NA,NA,NA,NA,NA,Request Finished,42692.747491585644,1067-3229,NA,NA,NA,NA,NA,NA,NA,OCLC,NA,NA,NA,NA,Separating Fact from Fiction :  An Empirical Examination of Six Myths About Dissociative Identity Disorder,Harvard review of psychiatry.,24,4,2016,257-270,"Brand, Bethany L.,",NA,"St. Louis, MO : Mosby, ©1993-",42692.65874239583,"St. Louis, MO : Mosby, ©1993-",NA,NA,NA,NA,NA,NA,NA,NA,10.1097/HRP.0000000000000100,1,10.1097/HRP.0000000000000100,doi,https://doi.org/10.1097/HRP.0000000000000100,http://europepmc.org/backend/ptpmcrender.fcgi?accid=PMC4959824&blobtype=pdf,article,eupmc,NA,oa_found
pacific,lending,10.1097/HRP.0000000000000100,NA,NA,NA,NA,NA,NA,NA,Request Finished,42872.52953665509,10673229,NA,NA,NA,NA,NA,NA,NA,OCLC,NA,NA,NA,NA,"Brand, Bethany L.: Separating fact from fiction: An empirical examination of six myths about dissociative identity disorder.",Harvard review of psychiatry.,24,4,7 2016,257-270,"Harvard Medical School. Brand, Bethany L.",NA,"St. Louis, MO : Mosby, 1993",42872.43405570601,"St. Louis, MO : Mosby, 1993",NA,NA,NA,NA,NA,NA,NA,NA,10.1097/HRP.0000000000000100,1,10.1097/HRP.0000000000000100,doi,https://doi.org/10.1097/HRP.0000000000000100,http://europepmc.org/backend/ptpmcrender.fcgi?accid=PMC4959824&blobtype=pdf,article,eupmc,NA,oa_found
pacific,lending,10.1097/NMD.0000000000000548,NA,NA,NA,NA,NA,NA,NA,Request Finished,42774.74010833333,0022-3018,NA,NA,NA,NA,NA,NA,NA,OCLC,NA,NA,NA,NA,The Psychology of Schizophrenia: Implications for Biological and Psychotherapeutic Treatments.,Journal of nervous and mental disease.,204,8,2016,564-569,"Dewan, Mantosh",NA,"Baltimore, MD, Williams & Wilkins",42774.657982638884,"Baltimore, MD, Williams & Wilkins",NA,NA,NA,NA,NA,NA,NA,NA,10.1097/NMD.0000000000000548,1,10.1097/NMD.0000000000000548,doi,https://doi.org/10.1097/NMD.0000000000000548,NA,NA,NA,NA,oa_not_found
pacific,lending,10.1097/PTS.0b013e3182753e4f,NA,NA,NA,NA,NA,NA,NA,Request Finished,42662.44223475694,1549-8417,NA,NA,NA,NA,NA,NA,NA,OCLC,NA,NA,NA,NA,Inpatient fall prevention: use of in-room Webcams.,Journal of patient safety.,9,1,2013-03-01,29-35,NA,NA,"Philadelphia : Lippincott, Williams and Wilkins.",42662.3305403125,"Philadelphia : Lippincott, Williams and",NA,NA,NA,NA,NA,NA,NA,NA,10.1097/PTS.0b013e3182753e4f,1,10.1097/PTS.0b013e3182753e4f,doi,https://doi.org/10.1097/PTS.0b013e3182753e4f,https://digitalcommons.wayne.edu/crp/vol3/iss2/11/,article,base,NA,oa_found
pacific,lending,10.1097/WNF.0000000000000161,NA,NA,NA,NA,NA,NA,NA,Request Finished,42758.825594988426,0362-5664,NA,NA,NA,NA,NA,NA,NA,OCLC,NA,NA,NA,NA,Efficacy and Safety of Levosulpiride Versus Haloperidol Injection in Patients With Acute Psychosis: A Randomized Double-Blind Study.,Clinical neuropharmacology.,39,4,2016 Jul-Aug,197-200,Lavania S,NA,"New York, Raven Press, 1976-",42758.789194363424,"New York, Raven Press, 1976-",NA,NA,NA,NA,NA,NA,NA,NA,10.1097/WNF.0000000000000161,1,10.1097/WNF.0000000000000161,doi,https://doi.org/10.1097/WNF.0000000000000161,NA,NA,NA,NA,oa_not_found
pacific,lending,10.1101/lm.041178.115,NA,NA,NA,NA,NA,NA,NA,Request Finished,42717.83296461806,1072-0502,NA,NA,NA,NA,NA,NA,NA,DOC,NA,NA,NA,NA,Practice makes perfect in memory recall.,"Learning & memory (Cold Spring Harbor, N.Y.)",23,4,2016,169-73,Romani S;Katkov M;Tsodyks M,NA,NA,42717.799077777774,"Cold Spring Harbor Laboratory Press, Col",NA,NA,NA,NA,NA,NA,NA,NA,10.1101/lm.041178.115,1,10.1101/lm.041178.115,doi,https://doi.org/10.1101/lm.041178.115,http://europepmc.org/backend/ptpmcrender.fcgi?accid=PMC4793200&blobtype=pdf,article,eupmc,NA,oa_found
pacific,lending,10.1111/j.1442-9071.1986.tb00027.x,NA,NA,NA,NA,NA,NA,NA,Request Finished,42605.72490393518,0814-9763,NA,NA,NA,NA,NA,NA,NA,DOC,NA,NA,NA,NA,"A family of squints: the differing effects of hypermetropia  
",Australian and New Zealand journal of ophthalmology,14,2,1986,155-9,Hilton AF,NA,NA,42604.80873923611,"Blackwell Science Asia, Carlton South, V",NA,NA,NA,NA,NA,NA,NA,NA,10.1111/j.1442-9071.1986.tb00027.x,1,10.1111/j.1442-9071.1986.tb00027.x,doi,https://doi.org/10.1111/j.1442-9071.1986.tb00027.x,https://onlinelibrary.wiley.com/doi/pdf/10.1111/j.1442-9071.1986.tb00027.x,article,oadoi,NA,oa_found
pacific,lending,10.1111/j.1559-1816.2004.tb02690.x,NA,NA,NA,NA,NA,NA,NA,Request Finished,42600.44069710648,0021-9029,NA,NA,NA,NA,NA,NA,NA,DOC,NA,NA,NA,NA,Intrinsic need satisfaction: a motivational basis of perform,Journal of applied social psychology,34,10,2004,2045,"Baard, Paul P",NA,NA,42600.43299193287,"Scripta Publishing Corporation, Washingt",NA,NA,NA,NA,NA,NA,NA,NA,10.1111/j.1559-1816.2004.tb02690.x,1,10.1111/j.1559-1816.2004.tb02690.x,doi,https://doi.org/10.1111/j.1559-1816.2004.tb02690.x,https://recyt.fecyt.es//index.php/RICYDE/article/view/43821,article,base,NA,oa_found
pacific,lending,10.1111/jce.12849,NA,NA,NA,NA,NA,NA,NA,Request Finished,42647.74787253472,1045-3873,NA,NA,NA,NA,NA,NA,NA,OCLC,NA,NA,NA,NA,The Impact of Age on 5-Year Outcomes After Atrial Fibrillation Catheter Ablation.,Journal of cardiovascular electrophysiology.,27(2):141-6,2,2016 Feb,141-6,Bunch TJ et al,NA,"Mt. Kisco, N.Y. : Futura Pub., ©1990-",42647.64489467593,"Mt. Kisco, N.Y. : Futura Pub., ©1990-",NA,NA,NA,NA,NA,NA,NA,NA,10.1111/jce.12849,1,10.1111/jce.12849,doi,https://doi.org/10.1111/jce.12849,NA,NA,NA,NA,oa_not_found
pacific,lending,10.1111/jphd.12067,NA,NA,NA,NA,NA,NA,NA,Request Finished,42772.798349687495,0022-4006,NA,NA,NA,NA,NA,NA,NA,DOC,NA,NA,NA,NA,Cost-effectiveness of a disease management program for early,Journal of public health dentistry,75,1,2015,24-33,Samnaliev M;Wijeratne R;Kwon EG;Ohiomoba H;Ng MW,NA,NA,42772.72939444444,American Association of Public Health De,NA,NA,NA,NA,NA,NA,NA,NA,10.1111/jphd.12067,1,10.1111/jphd.12067,doi,https://doi.org/10.1111/jphd.12067,NA,NA,NA,NA,oa_not_found
pacific,lending,10.1111/lic3.12340,NA,NA,NA,NA,NA,NA,NA,Request Finished,42838.530830902775,1741-4113,NA,NA,NA,NA,NA,NA,NA,OCLC,NA,NA,NA,NA,Performing Shakespeare in Europe,Literature compass.,13,11,11 2016,711-723,"Mancewicz, Aneta,",NA,Jan. 2003/Dec. 2004-<May 2007> : [England] : Blackwell Synergy,42838.40737141204,Jan. 2003/Dec. 2004-<May 2007> : [Englan,NA,NA,NA,NA,NA,NA,NA,NA,10.1111/lic3.12340,1,10.1111/lic3.12340,doi,https://doi.org/10.1111/lic3.12340,http://eprints.kingston.ac.uk/36159/,article,base,NA,oa_found
pacific,lending,10.1111/sms.12707,NA,NA,NA,NA,NA,NA,NA,Request Finished,42576.58607233796,0905-7188,NA,NA,NA,NA,NA,NA,NA,OCLC,NA,NA,NA,NA,Comparison of patient-reported outcomes among those who chose ACL reconstruction or non-surgical treatment.,Scandinavian journal of medicine and science in sports.,-,-,2016 June 23,epub,Ardern,NA,Blackwell Science.,42576.385914502316,Blackwell Science.,NA,NA,NA,NA,NA,NA,NA,NA,10.1111/sms.12707,1,10.1111/sms.12707,doi,https://doi.org/10.1111/sms.12707,NA,NA,NA,NA,oa_not_found
pacific,lending,10.1123/japa.2016-0173,NA,NA,NA,NA,NA,NA,NA,Request Finished,42877.625640081016,1063-8652,NA,NA,NA,NA,NA,NA,NA,DOC,NA,NA,NA,NA,Efficacy of an Exercise and Nutritional Supplement Program o,Journal of aging and physical activity,NA,NA,2017,1-32,Corcoran MP;Nelson ME;Sacheck JM;Reid KF;Kirn D;Fielding RA;,NA,NA,42877.608034108795,"Human Kinetics Publishers, Inc., Champai",NA,NA,NA,NA,NA,NA,NA,NA,10.1123/japa.2016-0173,1,10.1123/japa.2016-0173,doi,https://doi.org/10.1123/japa.2016-0173,NA,NA,NA,NA,oa_not_found
pacific,lending,10.1123/japa.21.3.348,NA,NA,NA,NA,NA,NA,NA,Request Finished,42759.47422997685,1063-8652,NA,NA,NA,NA,NA,NA,NA,DOC,NA,NA,NA,NA,Older black women's experiences initiating and maintaining p,Journal of aging and physical activity,21,3,2013,348-66,Price AE;Greer B;Tucker A,NA,NA,42759.47242241898,"Human Kinetics Publishers, Inc., Champai",NA,NA,NA,NA,NA,NA,NA,NA,10.1123/japa.21.3.348,1,10.1123/japa.21.3.348,doi,https://doi.org/10.1123/japa.21.3.348,NA,NA,NA,NA,oa_not_found
pacific,lending,10.1123/jsr.2016-0003,NA,NA,NA,NA,NA,NA,NA,Request Finished,42632.80944537037,1056-6716,NA,NA,NA,NA,NA,NA,NA,DOC,NA,NA,NA,NA,Immediate Effects of PNF Stretching Programs Compared to Pas,Journal of sport rehabilitation,NA,NA,NA,NA,Hill KJ;Robinson KP;Cuchna JW;Hoch MC,NA,NA,42632.80281427083,"Human Kinetics Publishers, Inc., Champai",NA,NA,NA,NA,NA,NA,NA,NA,10.1123/jsr.2016-0003,1,10.1123/jsr.2016-0003,doi,https://doi.org/10.1123/jsr.2016-0003,https://journals.humankinetics.com/action/captchaChallenge?redirectUri=%2Fdoi%2Fpdf%2F10.1123%2Fjsr.2016-0003,article,oadoi,NA,oa_found
pacific,lending,10.1123/jsr.2016-0026,NA,NA,NA,NA,NA,NA,NA,Request Finished,42892.72007280093,1056-6716,NA,NA,NA,NA,NA,NA,NA,DOC,NA,NA,NA,NA,Preferred Hip Strategy During Landing Reduces Knee Abduction,Journal of sport rehabilitation,NA,NA,2017,1-19,Nguyen AD;Taylor JB;Wimbish TG;Keith JL;Ford KR,NA,NA,42892.71573483796,"Human Kinetics Publishers, Inc., Champai",NA,NA,NA,NA,NA,NA,NA,NA,10.1123/jsr.2016-0026,1,10.1123/jsr.2016-0026,doi,https://doi.org/10.1123/jsr.2016-0026,NA,NA,NA,NA,oa_not_found
pacific,lending,10.1123/jsr.2016-0246,NA,NA,NA,NA,NA,NA,NA,Request Finished,42811.677523611106,1056-6716,NA,NA,NA,NA,NA,NA,NA,DOC,NA,NA,NA,NA,Hip Musculoskeletal Conditions and Associated Factors That I,Journal of sport rehabilitation,NA,NA,2017,1-31,Cheatham SW;Stull KR;Fantigrassi M;Montel I,NA,NA,42811.6238383912,"Human Kinetics Publishers, Inc., Champai",NA,NA,NA,NA,NA,NA,NA,NA,10.1123/jsr.2016-0246,1,10.1123/jsr.2016-0246,doi,https://doi.org/10.1123/jsr.2016-0246,NA,NA,NA,NA,oa_not_found
pacific,lending,10.1123/jsr.2017-0038,NA,NA,NA,NA,NA,NA,NA,Request Finished,42874.80249690972,1056-6716,NA,NA,NA,NA,NA,NA,NA,DOC,NA,NA,NA,NA,Physiological and Performance Measures for Baseline Concussi,Journal of sport rehabilitation,NA,NA,2017,1-24,Dobney DM;Thomas SG;Taha T;Keightley M,NA,NA,42874.78856466435,"Human Kinetics Publishers, Inc., Champai",NA,NA,NA,NA,NA,NA,NA,NA,10.1123/jsr.2017-0038,1,10.1123/jsr.2017-0038,doi,https://doi.org/10.1123/jsr.2017-0038,NA,NA,NA,NA,oa_not_found
pacific,lending,10.1136/bjsports-2015-095422,NA,NA,NA,NA,NA,NA,NA,Request Finished,42636.856793437495,0306-3674,NA,NA,NA,NA,NA,NA,NA,DOC,NA,NA,NA,NA,"Revisiting the continuum model of tendon pathology: what is  
",British journal of sports medicine,50,19,2016,1187-91,Cook JL;Rio E;Purdam CR;Docking SI,NA,NA,42636.714625960645,"BMJ Publishing Group, London :",NA,NA,NA,NA,NA,NA,NA,NA,10.1136/bjsports-2015-095422,1,10.1136/bjsports-2015-095422,doi,https://doi.org/10.1136/bjsports-2015-095422,http://europepmc.org/backend/ptpmcrender.fcgi?accid=PMC5118437&blobtype=pdf,article,eupmc,NA,oa_found
pacific,lending,10.1136/bjsports-2016-097470,NA,NA,NA,NA,NA,NA,NA,Request Finished,42900.633168368055,0306-3674,NA,NA,NA,NA,NA,NA,NA,DOC,NA,NA,NA,NA,Approach to investigation and treatment of persistent sympto,British journal of sports medicine,51,12,2017,958-968,Makdissi M;Schneider KJ;Feddermann-Demont N;Guskiewicz KM;Hi,NA,NA,42900.628612615736,"BMJ Publishing Group, London :",NA,NA,NA,NA,NA,NA,NA,NA,10.1136/bjsports-2016-097470,1,10.1136/bjsports-2016-097470,doi,https://doi.org/10.1136/bjsports-2016-097470,NA,NA,NA,NA,oa_not_found
pacific,lending,10.1136/bmj.i1642,NA,NA,NA,NA,NA,NA,NA,Request Finished,42759.805283877315,0959-8138,NA,NA,NA,NA,NA,NA,NA,OCLC,NA,NA,NA,NA,US researchers blocked from testing Cuban drug,BMJ : British medical journal /,352,NA,2016,i1642-,"Lenzer, Jeanne",NA,"London : British Medical Association, 1988-",42759.76899413194,"London : British Medical Association, 19",NA,NA,NA,NA,NA,NA,NA,NA,10.1136/bmj.i1642,1,10.1136/bmj.i1642,doi,https://doi.org/10.1136/bmj.i1642,NA,NA,NA,NA,oa_not_found
pacific,lending,10.1136/jnnp.2011.240390,NA,NA,NA,NA,NA,NA,NA,Request Finished,42759.56975567129,0022-3050,NA,NA,NA,NA,NA,NA,NA,DOC,NA,NA,NA,NA,Increased risk of stroke after Bell's palsy: a population-ba,"Journal of neurology, neurosurgery, and psychiatry",83,3,2012,341-3,Chiu YN;Yen MF;Chen LS;Pan SL,NA,NA,42759.54782762731,"BMJ Publishing Group, London :",NA,NA,NA,NA,NA,NA,NA,NA,10.1136/jnnp.2011.240390,1,10.1136/jnnp.2011.240390,doi,https://doi.org/10.1136/jnnp.2011.240390,NA,NA,NA,NA,oa_not_found
pacific,lending,10.1146/annurev.psych.57.102904.190057,NA,NA,NA,NA,NA,NA,NA,Request Finished,42891.54540300926,0066-4308,NA,NA,NA,NA,NA,NA,NA,OCLC,NA,NA,NA,NA,Child Development and the Physical Environment,Annual review of psychology.,57,NA,2006,423-451,NA,NA,"Palo Alto, Calif, Annual Reviews.",42891.54260219907,"Palo Alto, Calif, Annual Reviews.",NA,NA,NA,NA,NA,NA,NA,NA,10.1146/annurev.psych.57.102904.190057,1,10.1146/annurev.psych.57.102904.190057,doi,https://doi.org/10.1146/annurev.psych.57.102904.190057,NA,NA,NA,NA,oa_not_found
pacific,lending,10.1161/STROKEAHA.115.010319,NA,NA,NA,NA,NA,NA,NA,Request Finished,42670.55487734953,0039-2499,NA,NA,NA,NA,NA,NA,NA,OCLC,NA,NA,NA,NA,Effects of Blood Pressure and Blood Pressure-Lowering Treatment During the First 24 Hours Among Patients in the Third International Stroke Trial of Th,Stroke.,46,12,2015,3362-3369,"Berge, Eivind,",NA,"[Dallas, etc.], [American Heart Association]",42670.43585744213,"[Dallas, etc.], [American Heart Associat",NA,NA,NA,NA,NA,NA,NA,NA,10.1161/STROKEAHA.115.010319,1,10.1161/STROKEAHA.115.010319,doi,https://doi.org/10.1161/STROKEAHA.115.010319,NA,NA,NA,NA,oa_not_found
pacific,lending,10.1177/0020764014535752,NA,NA,NA,NA,NA,NA,NA,Request Finished,42773.656969641204,0020-7640,NA,NA,NA,NA,NA,NA,NA,OCLC,NA,NA,NA,NA,Mental health interventions for traumatized asylum seekers and refugees: What do we know about their efficacy?,The International journal of social psychiatry.,61,1,2015,17-,"Slobodin O,",NA,[London] Avenue Pub. Co.,42773.63044876157,[London] Avenue Pub. Co.,NA,NA,NA,NA,NA,NA,NA,NA,10.1177/0020764014535752,1,10.1177/0020764014535752,doi,https://doi.org/10.1177/0020764014535752,NA,NA,NA,NA,oa_not_found
pacific,lending,10.1177/0145445513478633,NA,NA,NA,NA,NA,NA,NA,Request Finished,42863.55943773148,0145-4455,NA,NA,NA,NA,NA,NA,NA,OCLC,NA,NA,NA,NA,Acceptance and Commitment Therapy as a Novel Treatment for Eating Disorders: An Initial Test of Efficacy and Mediation,Behavior modification.,37,4,2013,459-89,"Juarascio, Adrienne",NA,"[Thousand Oaks, Calif, etc.] [Sage Publications]",42863.54917804398,"[Thousand Oaks, Calif, etc.] [Sage Publi",NA,NA,NA,NA,NA,NA,NA,NA,10.1177/0145445513478633,1,10.1177/0145445513478633,doi,https://doi.org/10.1177/0145445513478633,NA,NA,NA,NA,oa_not_found
pacific,lending,10.1177/030802269605900604,NA,NA,NA,NA,NA,NA,NA,Request Finished,42858.94242850694,0308-0226,NA,NA,NA,NA,NA,NA,NA,OCLC,NA,NA,NA,NA,The Theory/Practice Divide: Bridging the Gap in Occupational Therapy,The British journal of occupational therapy.,59,6,1996,264-268,"Steward, Barbara",NA,2014- : London : Sage,42858.461873263885,2014- : London : Sage,NA,NA,NA,NA,NA,NA,NA,NA,10.1177/030802269605900604,1,10.1177/030802269605900604,doi,https://doi.org/10.1177/030802269605900604,NA,NA,NA,NA,oa_not_found
pacific,lending,10.1177/0361684310397698,NA,NA,NA,NA,NA,NA,NA,Request Finished,42682.452683993055,0361-6843 1471-6402,NA,NA,NA,NA,NA,NA,NA,OCLC,NA,NA,NA,NA,"Leaks, lumps, and lines: Stigma and women’s bodies.",Psychology of women quarterly.,"35(2), 202-214",NA,2011,NA,"American Psychological Association; Society for the Psychology of Women Chrisler, J. C.",NA,"[Thousand Oaks, California?, etc.] [SAGE, etc.]",42682.45184255787,"[Thousand Oaks, California?, etc.] [SAGE",NA,NA,NA,NA,NA,NA,NA,NA,10.1177/0361684310397698,1,10.1177/0361684310397698,doi,https://doi.org/10.1177/0361684310397698,NA,NA,NA,NA,oa_not_found
pacific,lending,10.1177/0957154X04044598,NA,NA,NA,NA,NA,NA,NA,Request Finished,42828.534413657406,0957-154X,NA,NA,NA,NA,NA,NA,NA,OCLC,NA,NA,NA,NA,On the Origin of the Clinical Standpoint in Psychiatry.,History of psychiatry.,15,"59,pt3",09 2004,349-,"Hecker,",NA,"Chalfont St. Giles, Bucks, England : Alpha Academic, in collaboration with the Royal College of Psychiatrists, 1990-",42828.514327199075,"Chalfont St. Giles, Bucks, England : Alp",NA,NA,NA,NA,NA,NA,NA,NA,10.1177/0957154X04044598,1,10.1177/0957154X04044598,doi,https://doi.org/10.1177/0957154X04044598,NA,NA,NA,NA,oa_not_found
pacific,lending,10.1177/0959353512454615,NA,NA,NA,NA,NA,NA,NA,Request Finished,42822.49076890046,0959-3535,NA,NA,NA,NA,NA,NA,NA,OCLC,NA,NA,NA,NA,Feminism versus femininity? Exploring feminist dilemmas through cooperative inquiry research,Feminism & psychology.,23,2,2013,207-223,"Riley, Sarah",NA,"London ; Newbury Park, CA : Sage Publications, ©1991-",42822.41557650463,"London ; Newbury Park, CA : Sage Publica",NA,NA,NA,NA,NA,NA,NA,NA,10.1177/0959353512454615,1,10.1177/0959353512454615,doi,https://doi.org/10.1177/0959353512454615,http://cadair.aber.ac.uk/dspace/handle/2160/42995,article,base,NA,oa_found
pacific,lending,10.1177/096834459900600202,NA,NA,NA,NA,NA,NA,NA,Request Finished,42795.513384259255,1477-0385,NA,NA,NA,NA,NA,NA,NA,OCLC,NA,NA,NA,NA,Why the British Were on the Somme in 1916,War in history.,6,NA,April 1999,pp 147-173,Elizabeth Greenhalgh,NA,<2997>-July 2006 : [London] : Edward Arnold Pub.,42795.33087554398,<2997>-July 2006 : [London] : Edward Arn,NA,NA,NA,NA,NA,NA,NA,NA,10.1177/096834459900600202,1,10.1177/096834459900600202,doi,https://doi.org/10.1177/096834459900600202,NA,NA,NA,NA,oa_not_found
pacific,lending,10.1177/1099800403252566,NA,NA,NA,NA,NA,NA,NA,Request Finished,42653.64827346065,1099-8004,NA,NA,NA,NA,NA,NA,NA,OCLC,NA,NA,NA,NA,Current initiatives for emergency preparedness response: commentary on 'new challenges for public health care: biological and chemical weapons awarene,Biological research for nursing.,4,4,2003-04,255-257,"Weiner, Betsy",NA,"Thousand Oaks, CA : Sage Publications, ©1999-",42653.44133313657,"Thousand Oaks, CA : Sage Publications, ©",NA,NA,NA,NA,NA,NA,NA,NA,10.1177/1099800403252566,1,10.1177/1099800403252566,doi,https://doi.org/10.1177/1099800403252566,NA,NA,NA,NA,oa_not_found
pacific,lending,10.1177/1363459303007001304,NA,NA,NA,NA,NA,NA,NA,Request Finished,42564.481170451385,1363-4593,NA,NA,NA,NA,NA,NA,NA,OCLC,NA,NA,NA,NA,A Matter of Integrity? Affliction and healing in Christian Science,Health.,7,1,Jan 2003,NA,Jaye,NA,"London : Sage Publications, ©1997-",42564.42514803241,"London : Sage Publications, ©1997-",NA,NA,NA,NA,NA,NA,NA,NA,10.1177/1363459303007001304,1,10.1177/1363459303007001304,doi,https://doi.org/10.1177/1363459303007001304,NA,NA,NA,NA,oa_not_found
pacific,lending,10.1177/1460458211414843,NA,NA,NA,NA,NA,NA,NA,Request Finished,42713.55013834491,1460-4582,NA,NA,NA,NA,NA,NA,NA,OCLC,NA,NA,NA,NA,"Exploring digital divides: An examination of eHealth technology use in health information seeking, communication and personal health information manag",Health informatics journal.,17,3,2011,224-243,"Lustria, Mia Liza A.,",NA,"Sheffield, UK : Sheffield Academic Press, [1997]-",42713.400382291664,"Sheffield, UK : Sheffield Academic Press",NA,NA,NA,NA,NA,NA,NA,NA,10.1177/1460458211414843,1,10.1177/1460458211414843,doi,https://doi.org/10.1177/1460458211414843,https://journals.sagepub.com/action/captchaChallenge?redirectUri=%2Fdoi%2F10.1177%2F1460458211414843,article,base,NA,oa_found
pacific,lending,10.1177/1460458215571769,NA,NA,NA,NA,NA,NA,NA,Request Finished,42906.49554386574,1460-4582,NA,NA,NA,NA,NA,NA,NA,OCLC,NA,NA,NA,NA,The process of development of a prioritization tool for a clinical decision support build within a computerized provider order entry system: Experienc,Health informatics journal.,22,3,9/2016,579-593,NA,NA,"Sheffield, UK : Sheffield Academic Press, [1997]-",42906.4893915162,"Sheffield, UK : Sheffield Academic Press",NA,NA,NA,NA,NA,NA,NA,NA,10.1177/1460458215571769,1,10.1177/1460458215571769,doi,https://doi.org/10.1177/1460458215571769,NA,NA,NA,NA,oa_not_found
