institution,type,doi,photo_article_title,photo_journal_title,photo_journal_volume,photo_journal_issue,photo_journal_year,photo_journal_inclusive_pages,photo_article_author,transaction_status,transaction_date,issn,base_fee,lending_library,reason_for_cancellation,call_number,location,maxcost,document_type,system_id,ifm_cost,copyright_payment_method,ccc_number,copyright_comp,article_title,journal_title,volume,issue,year,pages,article_author,x_1,cited_in,creation_date,photo_item_publisher,notes_on_access,notes,randon_number_generator,journal_volume,journal_issue,journal_year,journal_inclusive_pages,status,doi_input,doi_present,oabutton_query,oabutton_queryname,oabutton_match,oabutton_url,oabutton_type,oabutton_source,oabutton_title,oabutton_oa_result
PSU,lending,10.1177/1049732316654870,NA,NA,NA,NA,NA,NA,NA,NA,42649.56714652778,1049-7323,NA,NA,NA,NA,NA,NA,NA,NA,NA,NA,NA,NA,Member Checking A Tool to Enhance Trustworthiness or Merely a Nod to Validation?,Qualitative health research,26,13,Nov 2016,1802-1811,NA,NA,"Newbury Park, CA : Sage Publications, ©1991-",NA,NA,NA,NA,NA,NA,NA,NA,NA,NA,10.1177/1049732316654870,1,10.1177/1049732316654870,doi,https://doi.org/10.1177/1049732316654870,https://kclpure.kcl.ac.uk/portal/files/52859539/Member_checking_a_tool_BIRT_Accepted_2016_GREEN_AAM.pdf,article,oadoi,NA,oa_found
PSU,lending,NA,NA,NA,NA,NA,NA,NA,NA,NA,42664.4080346412,0419-4217,NA,NA,NA,NA,NA,NA,NA,NA,NA,NA,NA,NA,Homeless school-age children,"Dissertation abstracts international. B, The sciences and engineering",56,9-B,1995,177,"Smith, Karen",NA,"Ann Arbor, Mich. : University Microfilms, 1969-",NA,NA,NA,Dissertation//not available from University of Denver,NA,NA,NA,NA,NA,NA,http://search.proquest.com/docview/304185957,0,Homeless school-age children,title,TITLE:Homeless school-age children,NA,NA,NA,NA,oa_not_found
PSU,lending,10.1016/0923-1137(94)90015-9,NA,NA,NA,NA,NA,NA,NA,NA,42726.66285721065,0923-1137,NA,NA,NA,NA,NA,NA,NA,NA,NA,NA,NA,NA,Uptake of uranyl ions by new sorbing polymers: discussion of adsorption isotherms and pH effect,Reactive polymers,23,2-3,1994,147-156,Guibal et al.,NA,"Amsterdam ; New York : Elsevier, 1989-c1995.",NA,NA,NA,NA,NA,NA,NA,NA,NA,NA,10.1016/0923-1137(94)90015-9,1,10.1016/0923-1137(94)90015-9,doi,https://doi.org/10.1016/0923-1137(94)90015-9,NA,NA,NA,NA,oa_not_found
PSU,lending,10.1016/0091-3057(84)90199-0,NA,NA,NA,NA,NA,NA,NA,NA,42709.53113935185,0091-3057,NA,NA,NA,NA,NA,NA,NA,NA,NA,NA,NA,NA,The effect of second-order schedule history on fixed-ratio performance maintained by orally-delivered phencyclidine in rhesus monkeys,"Pharmacology, biochemistry and behavior",20,5,1984,779-787,"Carroll, ME",NA,"Amsterdam, Elsevier.",NA,NA,NA,NA,NA,NA,NA,NA,NA,NA,10.1016/0091-3057(84)90199-0,1,10.1016/0091-3057(84)90199-0,doi,https://doi.org/10.1016/0091-3057(84)90199-0,NA,NA,NA,NA,oa_not_found
PSU,lending,10.1016/j.geoforum.2006.09.002,NA,NA,NA,NA,NA,NA,NA,NA,42859.593398993056,0016-7185,NA,NA,NA,NA,NA,NA,NA,NA,NA,NA,NA,NA,Neoliberalism and the making of food politics in California,Geoforum,39,3,2008,1171-1183,Julie Guthman,NA,Oxford ; New York : Pergamon Press,NA,NA,NA,NA,NA,NA,NA,NA,NA,NA,10.1016/j.geoforum.2006.09.002,1,10.1016/j.geoforum.2006.09.002,doi,https://doi.org/10.1016/j.geoforum.2006.09.002,NA,NA,NA,NA,oa_not_found
PSU,lending,10.1007/s40799-016-0103-z,NA,NA,NA,NA,NA,NA,NA,NA,42775.58978596065,0732-8818; 1747-1567,NA,NA,NA,NA,NA,NA,NA,NA,NA,NA,NA,NA,Self-Optimizing Robot Vision for Online Quality Control,Experimental techniques,40,3,2016,1051-1064,NA,NA,"[Westport, CT : Society for Experimental Stress Analysis]",NA,NA,NA,NA,NA,NA,NA,NA,NA,NA,10.1007/s40799-016-0103-z,1,10.1007/s40799-016-0103-z,doi,https://doi.org/10.1007/s40799-016-0103-z,NA,NA,NA,NA,oa_not_found
PSU,lending,NA,NA,NA,NA,NA,NA,NA,NA,NA,42594.47723020833,0004-5756,NA,NA,NA,NA,NA,NA,NA,NA,NA,NA,NA,NA,Methods of analysis for infant formula: food and drug administration and infant formula council collaborative study,Journal of the Association of Official Analytical Chemists,68,3,May-June 1985,NA,Tanner,NA,"[Washington, D.C.] : The Association, 1966-1991.",NA,NA,NA,online access only available from 2000,NA,NA,NA,NA,NA,NA,NA,0,Methods of analysis for infant formula: food and drug administration and infant formula council collaborative study,title,TITLE:Methods of analysis for infant formula: food and drug administration and infant formula council collaborative study,NA,NA,NA,NA,oa_not_found
PSU,lending,10.1080/09546559508427319,NA,NA,NA,NA,NA,NA,NA,NA,42832.6640380787,0954-6553,NA,NA,NA,NA,NA,NA,NA,NA,NA,NA,NA,NA,Violence and terror and the extreme right,Terrorism and Political Violence,7,4,12 1995,82-93,"Wilkinson, Paul",NA,"London : Frank Cass, 1989- <2007-> : Philadelphia, PA : Routledge, Taylor & Francis Group",NA,NA,NA,NA,NA,NA,NA,NA,NA,NA,10.1080/09546559508427319,1,10.1080/09546559508427319,doi,https://doi.org/10.1080/09546559508427319,NA,NA,NA,NA,oa_not_found
PSU,lending,NA,NA,NA,NA,NA,NA,NA,NA,NA,42823.52117248842,1052-6846,NA,NA,NA,NA,NA,NA,NA,NA,NA,NA,NA,NA,Meeting the Needs of All Students: Contributions of Effective School Leaders,Journal of school leadership,15,5,2005,546-570,NA,NA,"Lancaster, Pa. : Technomic Pub. Co., c1991-",NA,NA,NA,online access starts with 2009,NA,NA,NA,NA,NA,NA,NA,0,Meeting the Needs of All Students: Contributions of Effective School Leaders,title,TITLE:Meeting the Needs of All Students: Contributions of Effective School Leaders,NA,NA,NA,NA,oa_not_found
PSU,lending,10.1016/j.enpol.2008.10.042,NA,NA,NA,NA,NA,NA,NA,NA,42781.47176354167,0301-4215,NA,NA,NA,NA,NA,NA,NA,NA,NA,NA,NA,NA,Beyond Bush: Environmental politics and prospects for US climate policy,"Energy policy the international journal of the political, economic, planning, environmental and social aspects of energy.",37,3,March 2009,966-971,"Harris, Paul G.",NA,Amsterdam [u.a.] : Elsevier Science.,NA,NA,NA,NA,NA,NA,NA,NA,NA,NA,10.1016/j.enpol.2008.10.042,1,10.1016/j.enpol.2008.10.042,doi,https://doi.org/10.1016/j.enpol.2008.10.042,http://epubs.surrey.ac.uk/47153/19/Basel_Paper_Rev_Complete_HholdEnergyConsumption.pdf,article,base,NA,oa_found
PSU,lending,10.1017/S0032247400056849,NA,NA,NA,NA,NA,NA,NA,NA,42755.73060578704,0032-2474,NA,NA,NA,NA,NA,NA,NA,NA,NA,NA,NA,NA,Recent Polar Literature,The Polar record,14,89,1968,NA,NA,NA,Cambridge [Eng.] University Press.,NA,NA,NA,NA,NA,NA,NA,NA,NA,NA,10.1017/S0032247400056849,1,10.1017/S0032247400056849,doi,https://doi.org/10.1017/S0032247400056849,NA,NA,NA,NA,oa_not_found
PSU,lending,NA,NA,NA,NA,NA,NA,NA,NA,NA,42822.39361840278,0889-6143,NA,NA,NA,NA,NA,NA,NA,NA,NA,NA,NA,NA,A Place to Begin: Service-Learning Tutor Education and Writing Center Social Justice,The Writing center journal,35,1,2015,57-84,"Zimmerelli, Lisa",NA,"Albany, N.Y. : [s.n., 1980]-",NA,NA,NA,NA,NA,NA,NA,NA,NA,NA,http://www.jstor.org/stable/43673619,0,A Place to Begin: Service-Learning Tutor Education and Writing Center Social Justice,title,TITLE:A Place to Begin: Service-Learning Tutor Education and Writing Center Social Justice,NA,NA,NA,NA,oa_not_found
PSU,lending,10.1016/0013-9351(80)90120-6,NA,NA,NA,NA,NA,NA,NA,NA,42865.55948159722,0013-9351,NA,NA,NA,NA,NA,NA,NA,NA,NA,NA,NA,NA,"Relations between trophic position and mercury accumulation among fishes from the Tongue River Reservoir, Montana",Environmental research,22,1,June 1980,73-80,"Phillips, G. R.",NA,"Amsterdam, Elsevier.",NA,NA,NA,NA,NA,NA,NA,NA,NA,NA,10.1016/0013-9351(80)90120-6,1,10.1016/0013-9351(80)90120-6,doi,https://doi.org/10.1016/0013-9351(80)90120-6,NA,NA,NA,NA,oa_not_found
PSU,lending,10.1504/IJTM.2012.045547,NA,NA,NA,NA,NA,NA,NA,NA,42605.43039059028,0267-5730,NA,NA,NA,NA,NA,NA,NA,NA,NA,NA,NA,NA,Knowledge alliances and innovation performance: an empirical perspective on the role of network resources,International journal of technology management = Journal international de la gestion technologique,57,4,2012,245-265,"Huggins, Robert",NA,"Geneva : Inderscience Enterprises, c1986-",NA,NA,NA,NA,NA,NA,NA,NA,NA,NA,10.1504/IJTM.2012.045547,1,10.1504/IJTM.2012.045547,doi,https://doi.org/10.1504/IJTM.2012.045547,NA,NA,NA,NA,oa_not_found
PSU,lending,10.1006/jhev.1999.0324,NA,NA,NA,NA,NA,NA,NA,NA,42648.639134375,0047-2484,NA,NA,NA,NA,NA,NA,NA,NA,NA,NA,NA,NA,"Human cannibalism in the Early Pleistocene of Europe (Gran Dolina, Sierra de Atapuerca, Burgos, Spain)",Journal of human evolution,37,3/4,1999,591-622,"Fernandez-Jalvo, Yolanda",NA,"London, New York, Academic Press.",NA,NA,NA,NA,NA,NA,NA,NA,NA,NA,10.1006/jhev.1999.0324,1,10.1006/jhev.1999.0324,doi,https://doi.org/10.1006/jhev.1999.0324,http://estudiosgeol.revistas.csic.es/index.php/estudiosgeol/article/view/14,article,base,NA,oa_found
PSU,lending,10.1080/09589236.2014.959479,NA,NA,NA,NA,NA,NA,NA,NA,42829.53103908565,0958-9236,NA,NA,NA,NA,NA,NA,NA,NA,NA,NA,NA,NA,"Feminism, masculinity and male rape: bringing male rape 'out of the closet'",Journal of gender studies,25,3,20160501,283-,"Javaid, Aliraza",NA,"Hull : Hull Centre for Gender Studies, 1991-",NA,NA,NA,NA,NA,NA,NA,NA,NA,NA,10.1080/09589236.2014.959479,1,10.1080/09589236.2014.959479,doi,https://doi.org/10.1080/09589236.2014.959479,https://www.tandfonline.com/action/captchaChallenge?redirectUri=%2Fdoi%2Fpdf%2F10.1080%2F09589236.2014.959479%3FneedAccess%3Dtrue,article,oadoi,NA,oa_found
PSU,lending,10.1080/15475778.2016.1192916,NA,NA,NA,NA,NA,NA,NA,NA,42821.52621388889,1547-5778,NA,NA,NA,NA,NA,NA,NA,NA,NA,NA,NA,NA,Jordanian women's leadership styles in the lens of their masculinity-femininity value orientation,Journal of Transnational Management,21,3,2016-07-01,142-161,"Rayyan, Majd",NA,NA,NA,NA,NA,NA,NA,NA,NA,NA,NA,NA,10.1080/15475778.2016.1192916,1,10.1080/15475778.2016.1192916,doi,https://doi.org/10.1080/15475778.2016.1192916,NA,NA,NA,NA,oa_not_found
PSU,lending,10.1016/j.ecolecon.2016.01.018,NA,NA,NA,NA,NA,NA,NA,NA,42788.66866207176,0921-8009,NA,NA,NA,NA,NA,NA,NA,NA,NA,NA,NA,NA,Economic viability and small-scale fisheries - A review,Ecological economics : the journal of the International Society for Ecological Economics,124,NA,April 2016,69-75,Schuhbauer,NA,"Amsterdam, the Netherlands ; New York : Elsevier, c1989-",NA,NA,NA,NA,NA,NA,NA,NA,NA,NA,10.1016/j.ecolecon.2016.01.018,1,10.1016/j.ecolecon.2016.01.018,doi,https://doi.org/10.1016/j.ecolecon.2016.01.018,NA,NA,NA,NA,oa_not_found
PSU,lending,10.1577/T06-168.1,NA,NA,NA,NA,NA,NA,NA,NA,42853.59955659722,0002-8487,NA,NA,NA,NA,NA,NA,NA,NA,NA,NA,NA,NA,Assessing Small-Stream Biotic Integrity Using Fish Assemblages across an Urban Landscape in the Puget Sound Lowlands of Western Washington,Transactions of the American Fisheries Society,137,3,2008,677-689,"Matzen, Deanna Akre",NA,"[Bethesda, MD, etc., American Fisheries Society]",NA,NA,NA,NA,NA,NA,NA,NA,NA,NA,10.1577/T06-168.1,1,10.1577/T06-168.1,doi,https://doi.org/10.1577/T06-168.1,NA,NA,NA,NA,oa_not_found
PSU,lending,10.1080/13540602.2011.602212,NA,NA,NA,NA,NA,NA,NA,NA,42570.434976701385,1354-0602,NA,NA,NA,NA,NA,NA,NA,NA,NA,NA,NA,NA,Goal Orientation Toward Teaching Scale,Teachers and teaching : theory and practice,17,5,2011,597-610,Kucsera et al,NA,"Abingdon, Oxfordshire : Carfax, 1995-",NA,NA,NA,NA,NA,NA,NA,NA,NA,NA,10.1080/13540602.2011.602212,1,10.1080/13540602.2011.602212,doi,https://doi.org/10.1080/13540602.2011.602212,NA,NA,NA,NA,oa_not_found
PSU,lending,NA,NA,NA,NA,NA,NA,NA,NA,NA,42665.61993920139,0081-1904,NA,NA,NA,NA,NA,NA,NA,NA,NA,NA,NA,NA,Soil moisture and redoximorphic features; a historical perspective,SSSA special publication series,54,NA,1998,1-23,"Veneman, Peter L.",NA,"Madison, Wis. : Soil Science Society of America, 1967-",NA,NA,NA,book chapter,NA,NA,NA,NA,NA,NA,https://dl.sciencesocieties.org/publications/books/abstracts/sssaspecialpubl/quantifyingsoil/1,0,Soil moisture and redoximorphic features; a historical perspective,title,TITLE:Soil moisture and redoximorphic features; a historical perspective,NA,NA,NA,NA,oa_not_found
PSU,lending,10.1039/C6DT00634E,NA,NA,NA,NA,NA,NA,NA,NA,42815.53009479166,1477-9226,NA,NA,NA,NA,NA,NA,NA,NA,NA,NA,NA,NA,"The roles of 4f- and 5f-orbitals in bonding: a magnetochemical, crystal field, density functional theory, and multi-reference wavefunction study",Dalton transactions : an international journal of inorganic chemistry,45,28,2016,11508-11521,"Lukens, WW",NA,"Cambridge, UK : Royal Society of Chemistry, ©2003-",NA,NA,NA,NA,NA,NA,NA,NA,NA,NA,10.1039/C6DT00634E,1,10.1039/C6DT00634E,doi,https://doi.org/10.1039/C6DT00634E,http://pubs.rsc.org/en/content/articlepdf/2016/dt/c6dt00634e,article,oadoi,NA,oa_found
PSU,lending,10.1081/GNC-120003928,NA,NA,NA,NA,NA,NA,NA,NA,42615.603874189816,1059-0501,NA,NA,NA,NA,NA,NA,NA,NA,NA,NA,NA,NA,"The measurements of ambient particulates (TSP, PM2.5, PM2.5-10), chemical component concentration variation, and mutagenicity study during 1998-2001 in Central Taiwan","Journal of environmental science and health. Part C, Environmental carcinogenesis & ecotoxicology reviews",20,1,2002,49-59,"Wu, Y.S.",NA,"2005- : Philadelphia, PA : Taylor & Francis",NA,NA,NA,NA,NA,NA,NA,NA,NA,NA,10.1081/GNC-120003928,1,10.1081/GNC-120003928,doi,https://doi.org/10.1081/GNC-120003928,NA,NA,NA,NA,oa_not_found
PSU,lending,10.1016/j.jmoneco.2007.10.005,NA,NA,NA,NA,NA,NA,NA,NA,42865.43778707176,0304-3932,NA,NA,NA,NA,NA,NA,NA,NA,NA,NA,NA,NA,The future of social security,Journal of monetary economics,55,2,2008,197-218,Gonzalez-Eiras,NA,"1975- : Amsterdam, North-Holland Pub. Co.",NA,NA,NA,NA,NA,NA,NA,NA,NA,NA,10.1016/j.jmoneco.2007.10.005,1,10.1016/j.jmoneco.2007.10.005,doi,https://doi.org/10.1016/j.jmoneco.2007.10.005,https://boris.unibe.ch/29349/,article,base,NA,oa_found
PSU,lending,10.1146/annurev-soc-081715-074427,NA,NA,NA,NA,NA,NA,NA,NA,42754.69488167824,0360-0572,NA,NA,NA,NA,NA,NA,NA,NA,NA,NA,NA,NA,Religious Studies in Latin America,Annual review of sociology,42,NA,2016,473-492,"de la Torre, Rene",NA,"Palo Alto, Calif., Annual Reviews Inc.",NA,NA,NA,NA,NA,NA,NA,NA,NA,NA,10.1146/annurev-soc-081715-074427,1,10.1146/annurev-soc-081715-074427,doi,https://doi.org/10.1146/annurev-soc-081715-074427,NA,NA,NA,NA,oa_not_found
PSU,lending,10.1080/08946566.2015.1093987,NA,NA,NA,NA,NA,NA,NA,NA,42668.39755929398,0894-6566,NA,NA,NA,NA,NA,NA,NA,NA,NA,NA,NA,NA,Adult daughters’ descriptions of their mother–daughter relationship in the context of chronic conflict,Journal of elder abuse & neglect,27,4-5,2015,356-,"Pickering, Carolyn E. Z.",NA,"[Binghamton, NY] : Haworth Press, 1989-",NA,NA,NA,NA,NA,NA,NA,NA,NA,NA,10.1080/08946566.2015.1093987,1,10.1080/08946566.2015.1093987,doi,https://doi.org/10.1080/08946566.2015.1093987,NA,NA,NA,NA,oa_not_found
PSU,lending,NA,NA,NA,NA,NA,NA,NA,NA,NA,42793.63996747685,0096-1736,NA,NA,NA,NA,NA,NA,NA,NA,NA,NA,NA,NA,"A Prospective, nonrandomized study of iontophoresis, wrist splinting, and anti-inflammatory medication in the treatment of early-mild carpal tunnel sy",Journal of occupational medicine : official publication of the Industrial Medical Association,36,2,1994,166-168,Banta,NA,"Chicago : The Association, ©1959-©1994.",NA,NA,NA,Not available online due to age: 1994,NA,NA,NA,NA,NA,NA,NA,0,"A Prospective, nonrandomized study of iontophoresis, wrist splinting, and anti-inflammatory medication in the treatment of early-mild carpal tunnel sy",title,"TITLE:A Prospective, nonrandomized study of iontophoresis, wrist splinting, and anti-inflammatory medication in the treatment of early-mild carpal tunnel sy",NA,NA,NA,NA,oa_not_found
PSU,lending,10.1016/0305-0491(89)90250-2,NA,NA,NA,NA,NA,NA,NA,NA,42864.65030162037,0305-0491,NA,NA,NA,NA,NA,NA,NA,NA,NA,NA,NA,NA,"Comparison of glucose, sorbitol and fructose accumulation in lens and liver of diabetic and insulin-treated rats and mice","Comparative biochemistry and physiology. B, Comparative biochemistry",92,4,1989,685-eoa,"Bruce I. Gaynes, John B. Watkins III",NA,"London ; New York : Pergamon Press, ©1971-©1993.",NA,NA,NA,NA,NA,NA,NA,NA,NA,NA,10.1016/0305-0491(89)90250-2,1,10.1016/0305-0491(89)90250-2,doi,https://doi.org/10.1016/0305-0491(89)90250-2,NA,NA,NA,NA,oa_not_found
PSU,lending,10.1080/09518398.2016.1242801,NA,NA,NA,NA,NA,NA,NA,NA,42677.601411805554,0951-8398,NA,NA,NA,NA,NA,NA,NA,NA,NA,NA,NA,NA,'It doesn't speak to me': understanding student of color resistance to critical race pedagogy,International journal of qualitative studies in education : QSE,Latest Articles,NA,2016,1-19,Sonya M. Alemán & Sarita Gaytán,NA,"London ; Philadelphia : Taylor & Francis, [c1988]-",NA,NA,NA,NA,NA,NA,NA,NA,NA,NA,10.1080/09518398.2016.1242801,1,10.1080/09518398.2016.1242801,doi,https://doi.org/10.1080/09518398.2016.1242801,NA,NA,NA,NA,oa_not_found
PSU,lending,10.1016/j.chb.2016.09.031,NA,NA,NA,NA,NA,NA,NA,NA,42872.43106403935,0747-5632,NA,NA,NA,NA,NA,NA,NA,NA,NA,NA,NA,NA,Do you have anything to hide? Infidelity-related behaviors on social media sites and marital satisfaction,Computers in human behavior,66,NA,2017,88-95,"McDaniel, Brandon T.",NA,1985- New York : Pergamon <2013-> Amsterdam : Elsevier,NA,NA,NA,NA,NA,NA,NA,NA,NA,NA,10.1016/j.chb.2016.09.031,1,10.1016/j.chb.2016.09.031,doi,https://doi.org/10.1016/j.chb.2016.09.031,http://europepmc.org/backend/ptpmcrender.fcgi?accid=PMC5400109&blobtype=pdf,article,eupmc,NA,oa_found
PSU,lending,NA,NA,NA,NA,NA,NA,NA,NA,NA,42860.576105127315,0090-4155,NA,NA,NA,NA,NA,NA,NA,NA,NA,NA,NA,NA,On why technology can't improve society,Behaviorism,15,1,1987,NA,"Pitt, Joseph C.",NA,"Cambridge, Mass. Publications Dept., Cambridge Center for Behavioral Studies",NA,NA,NA,NA,NA,NA,NA,NA,NA,NA,http://www.jstor.org/stable/27759115,0,On why technology can't improve society,title,TITLE:On why technology can't improve society,NA,NA,NA,NA,oa_not_found
PSU,lending,10.1016/0021-9673(68)85061-7,NA,NA,NA,NA,NA,NA,NA,NA,42613.595345567126,0021-9673,NA,NA,NA,NA,NA,NA,NA,NA,NA,NA,NA,NA,"Cellulose thin layers for anthocyanin analysis, with special reference to the anthocyanins of black raspberries",Journal of chromatography,38,NA,1968,382-387,"Nybom, Nils",NA,"Amsterdam ; New York : Elsevier, ©1993-",NA,NA,NA,NA,NA,NA,NA,NA,NA,NA,10.1016/0021-9673(68)85061-7,1,10.1016/0021-9673(68)85061-7,doi,https://doi.org/10.1016/0021-9673(68)85061-7,NA,NA,NA,NA,oa_not_found
PSU,lending,10.1080/08946566.2011.608056,NA,NA,NA,NA,NA,NA,NA,NA,42726.44947866898,0894-6566,NA,NA,NA,NA,NA,NA,NA,NA,NA,NA,NA,NA,Physical Abuse of Older Adults in Nursing Homes: A Random Sample Survey of Adults With an Elderly Family Member in a Nursing Home,Journal of elder abuse & neglect,24,1,2012,65-83,NA,NA,"[Binghamton, NY] : Haworth Press, 1989-",NA,NA,NA,NA,NA,NA,NA,NA,NA,NA,10.1080/08946566.2011.608056,1,10.1080/08946566.2011.608056,doi,https://doi.org/10.1080/08946566.2011.608056,NA,NA,NA,NA,oa_not_found
PSU,lending,10.1577/1548-8675(1992)012<0634:HMOTSW>2.3.CO;2,NA,NA,NA,NA,NA,NA,NA,NA,42859.50654502315,0275-5947,NA,NA,NA,NA,NA,NA,NA,NA,NA,NA,NA,NA,Hooking Mortality of Trophy-Sized Wild Brook Trout Caught on Artificial Lures,North American journal of fisheries management,12,3,1992,634-644,Andrew J. Nuhfer Michigan,NA,"Lawrence, Kan. : American Fisheries Society, ©1981-",NA,NA,NA,NA,NA,NA,NA,NA,NA,NA,10.1577/1548-8675(1992)012<0634:HMOTSW>2.3.CO;2,1,10.1577/1548-8675(1992)012<0634:HMOTSW>2.3.CO;2,doi,https://doi.org/10.1577/1548-8675(1992)012<0634:HMOTSW>2.3.CO;2,NA,NA,NA,NA,oa_not_found
PSU,lending,10.1504/IJTM.2013.052673,NA,NA,NA,NA,NA,NA,NA,NA,42688.61376585648,0267-5730,NA,NA,NA,NA,NA,NA,NA,NA,NA,NA,NA,NA,Value creation and appropriation in social media - the case of fashion bloggers in Sweden,International journal of technology management = Journal international de la gestion technologique,61,3/4,4 2013,309-323,"Pihl, Christofer",NA,"Geneva : Inderscience Enterprises, c1986-",NA,NA,NA,NA,NA,NA,NA,NA,NA,NA,10.1504/IJTM.2013.052673,1,10.1504/IJTM.2013.052673,doi,https://doi.org/10.1504/IJTM.2013.052673,NA,NA,NA,NA,oa_not_found
PSU,lending,10.1177/0038038514543297,NA,NA,NA,NA,NA,NA,NA,NA,42891.539962118055,0038-0385; 0038-0385,NA,NA,NA,NA,NA,NA,NA,NA,NA,NA,NA,NA,‘Not Smiling but Frowning’: Sociology and the ‘Problem of Happiness’,Sociology,49,3,06/2015,422-437,"Cieslik, Mark",NA,"Oxford Clarendon Press Cambridge : Cambridge University Press London, England : Sage Publications",NA,NA,NA,NA,NA,NA,NA,NA,NA,NA,10.1177/0038038514543297,1,10.1177/0038038514543297,doi,https://doi.org/10.1177/0038038514543297,http://nrl.northumbria.ac.uk/22871/1/smiling%20frowning%20paper%20for%20Sociology%20final%20revised%20version%20april%2014.pdf,article,oadoi,NA,oa_found
PSU,lending,10.1103/PhysRevA.92.052120,NA,NA,NA,NA,NA,NA,NA,NA,42688.624193055555,1050-2947,NA,NA,NA,NA,NA,NA,NA,NA,NA,NA,NA,NA,Measuring non-Hermitian operators via weak values,"Physical review. A, Atomic, molecular, and optical physics",92,5-A,2015,052120,"Arun Kumar Pati, Uttam Singh, and Urbasi Sinha",NA,"New York, N.Y. : Published by the American Physical Society through the American Institute of Physics, ©1990-",NA,NA,NA,NA,NA,NA,NA,NA,NA,NA,10.1103/PhysRevA.92.052120,1,10.1103/PhysRevA.92.052120,doi,https://doi.org/10.1103/PhysRevA.92.052120,NA,NA,NA,NA,oa_not_found
PSU,lending,10.1016/j.quascirev.2006.04.010,NA,NA,NA,NA,NA,NA,NA,NA,42709.47733194444,0277-3791,NA,NA,NA,NA,NA,NA,NA,NA,NA,NA,NA,NA,Global glacial ice volume and Last Glacial Maximum duration from an extended Barbados sea level record,Quaternary science reviews,25,23,2006,3322-3337,"Peltier, WR",NA,"1982- : Oxford ; New York : Pergamon Press, c1982-",NA,NA,NA,NA,NA,NA,NA,NA,NA,NA,10.1016/j.quascirev.2006.04.010,1,10.1016/j.quascirev.2006.04.010,doi,https://doi.org/10.1016/j.quascirev.2006.04.010,NA,NA,NA,NA,oa_not_found
PSU,lending,10.1021/acs.analchem.6b01169,NA,NA,NA,NA,NA,NA,NA,NA,42843.418177858795,0003-2700,NA,NA,NA,NA,NA,NA,NA,NA,NA,NA,NA,NA,Ages at a Crime Scene: Simultaneous Estimation of the Time since Deposition and Age of Its Originator,Analytical chemistry,88,12,May 2016,6479–6484,Juliana Agudelo et al.,NA,"Washington : American Chemical Society, ©1948-",NA,NA,NA,NA,NA,NA,NA,NA,NA,NA,10.1021/acs.analchem.6b01169,1,10.1021/acs.analchem.6b01169,doi,https://doi.org/10.1021/acs.analchem.6b01169,NA,NA,NA,NA,oa_not_found
PSU,lending,10.1016/j.chb.2016.02.098,NA,NA,NA,NA,NA,NA,NA,NA,42803.42368356481,0747-5632,NA,NA,NA,NA,NA,NA,NA,NA,NA,NA,NA,NA,Understanding compulsive social media use: The premise of complementing self-conceptions mismatch with technology,Computers in human behavior,60,NA,7 2016,575-581,"Aladwani, Adel M.",NA,1985- New York : Pergamon <2013-> Amsterdam : Elsevier,NA,NA,NA,NA,NA,NA,NA,NA,NA,NA,10.1016/j.chb.2016.02.098,1,10.1016/j.chb.2016.02.098,doi,https://doi.org/10.1016/j.chb.2016.02.098,NA,NA,NA,NA,oa_not_found
PSU,lending,10.1017/S0022112076002012,NA,NA,NA,NA,NA,NA,NA,NA,42642.534755127315,0022-1120,NA,NA,NA,NA,NA,NA,NA,NA,NA,NA,NA,NA,An experimental and theoretical study of natural convection in the annulus between horizontal concentric cylinders,Journal of fluid mechanics,74,4,1976,695-,"Kuehn, T H",NA,"Cambridge New York, Cambridge University Press",NA,NA,NA,NA,NA,NA,NA,NA,NA,NA,10.1017/S0022112076002012,1,10.1017/S0022112076002012,doi,https://doi.org/10.1017/S0022112076002012,NA,NA,NA,NA,oa_not_found
PSU,lending,10.1080/13563475.2011.591147,NA,NA,NA,NA,NA,NA,NA,NA,42619.47625054398,1356-3475,NA,NA,NA,NA,NA,NA,NA,NA,NA,NA,NA,NA,Towards a Metropolitan Consciousness in the Portland Oregon Metropolitan Area,International planning studies,16,3,2011-08,289-304,"Cotugno, Andrew",NA,"Abingdon, Oxfordshire ; Cambridge, MA : Carfax Pub. Co., ©1996-",NA,NA,NA,NA,NA,NA,NA,NA,NA,NA,10.1080/13563475.2011.591147,1,10.1080/13563475.2011.591147,doi,https://doi.org/10.1080/13563475.2011.591147,NA,NA,NA,NA,oa_not_found
PSU,lending,10.1007/s10615-015-0560-3,NA,NA,NA,NA,NA,NA,NA,NA,42639.63947809028,1573-3343,NA,NA,NA,NA,NA,NA,NA,NA,NA,NA,NA,NA,Adopted children with reactive attachment disorder: A qualitative study on family processes.,Clinical social work journal,44,3,Sept 2016,319-332,"Vasquez, Matthew",NA,"[New York, N.Y.] : Human Sciences Press",NA,NA,NA,NA,NA,NA,NA,NA,NA,NA,10.1007/s10615-015-0560-3,1,10.1007/s10615-015-0560-3,doi,https://doi.org/10.1007/s10615-015-0560-3,NA,NA,NA,NA,oa_not_found
PSU,lending,NA,NA,NA,NA,NA,NA,NA,NA,NA,42726.66283190972,NA,NA,NA,NA,NA,NA,NA,NA,NA,NA,NA,NA,NA,Rankings for computer science programs (probably included in the engineering section),America's best graduate schools,NA,NA,1994,not cited,NA,NA,"Washington, DC : U.S. News and World Report, 1994-©1997.",NA,NA,NA,Not available due to age & poor citation,NA,NA,NA,NA,NA,NA,NA,0,Rankings for computer science programs (probably included in the engineering section),title,TITLE:Rankings for computer science programs (probably included in the engineering section),NA,NA,NA,NA,oa_not_found
PSU,lending,10.1080/07434618.2016.1213766,NA,NA,NA,NA,NA,NA,NA,NA,42856.52414753472,0743-4618,NA,NA,NA,NA,NA,NA,NA,NA,NA,NA,NA,NA,A meta-synthesis of team members’ voices: what we need and what we do to support students who use AAC,Augmentative and alternative communication : AAC,32,3,2016,175-,"Chung, Yun-Ching",NA,"2015- : Abingdon, Oxford : Taylor & Francis",NA,NA,NA,NA,NA,NA,NA,NA,NA,NA,10.1080/07434618.2016.1213766,1,10.1080/07434618.2016.1213766,doi,https://doi.org/10.1080/07434618.2016.1213766,NA,NA,NA,NA,oa_not_found
PSU,lending,10.1534/genetics.114.169748,NA,NA,NA,NA,NA,NA,NA,NA,42695.40274293981,0016-6731,NA,NA,NA,NA,NA,NA,NA,NA,NA,NA,NA,NA,Tetrahymena as a Unicellular Model Eukaryote: Genetic and Genomic Tools,Genetics,203,2,2016,649-665,NA,NA,"Bethesda, MD Genetics Society of America",NA,NA,NA,NA,NA,NA,NA,NA,NA,NA,10.1534/genetics.114.169748,1,10.1534/genetics.114.169748,doi,https://doi.org/10.1534/genetics.114.169748,http://europepmc.org/backend/ptpmcrender.fcgi?accid=PMC4896184&blobtype=pdf,article,eupmc,NA,oa_found
