institution,type,doi,photo_article_title,photo_journal_title,photo_journal_volume,photo_journal_issue,photo_journal_year,photo_journal_inclusive_pages,photo_article_author,transaction_status,transaction_date,issn,base_fee,lending_library,reason_for_cancellation,call_number,location,maxcost,document_type,system_id,ifm_cost,copyright_payment_method,ccc_number,copyright_comp,article_title,journal_title,volume,issue,year,pages,article_author,x_1,cited_in,creation_date,photo_item_publisher,notes_on_access,notes,randon_number_generator,journal_volume,journal_issue,journal_year,journal_inclusive_pages,status,doi_input,doi_present,oabutton_query,oabutton_queryname,oabutton_match,oabutton_url,oabutton_type,oabutton_source,oabutton_title,oabutton_oa_result
UP,borrow,10.1017/S1358246100008614,NA,NA,NA,NA,NA,NA,NA,NA,42593.18292954861,1358-2461,NA,web,NA,NA,NA,NA,NA,NA,NA,NA,NA,NA,Agency and Actions,Royal Institute of Philosophy Supplement,55,NA,2004,1-,NA,NA,EBSCO:Philosopher's Index:PHL2065798,NA,NA,NA,NA,NA,NA,NA,NA,NA,NA,10.1017/S1358246100008614,1,10.1017/S1358246100008614,doi,https://doi.org/10.1017/S1358246100008614,http://eprints.bbk.ac.uk/95/1/hornsby4.pdf,article,oadoi,NA,oa_found
UP,borrow,10.1080/10852350802022316,NA,NA,NA,NA,NA,NA,NA,NA,42872.19108078704,1085-2352,NA,web,NA,NA,NA,NA,NA,NA,NA,NA,NA,NA,Our Brotherhood and Your Sister: Building Anti-Rape Community in the Fraternity.,Journal of Prevention,36,1/2,2008,57-,NA,NA,EBSCO:Academic Search Premier:34157761,NA,NA,NA,NA,NA,NA,NA,NA,NA,NA,10.1080/10852350802022316,1,10.1080/10852350802022316,doi,https://doi.org/10.1080/10852350802022316,NA,NA,NA,NA,oa_not_found
UP,borrow,10.1098/rspb.2014.3139,NA,NA,NA,NA,NA,NA,NA,NA,42822.48228009259,0962-8452,NA,III,NA,NA,NA,NA,NA,NA,NA,NA,NA,NA,The interface between genetics and psychology: lessons from developmental dyslexia.,Proceedings. Biological sciences /,282,1806,2015,1-,NA,NA,EBSCO:Academic Search Premier:102601345,NA,NA,NA,NA,NA,NA,NA,NA,NA,NA,10.1098/rspb.2014.3139,1,10.1098/rspb.2014.3139,doi,https://doi.org/10.1098/rspb.2014.3139,http://europepmc.org/backend/ptpmcrender.fcgi?accid=PMC4426619&blobtype=pdf,article,eupmc,NA,oa_found
UP,borrow,10.1016/S0308-521X(00)00060-3,NA,NA,NA,NA,NA,NA,NA,NA,42663.1925715625,0308-521X,NA,web,NA,NA,NA,NA,NA,NA,NA,NA,NA,NA,Organic farming and the sustainability of agricultural systems,Agricultural systems,68,1,2001,21-,NA,NA,Elsevier:SD,NA,NA,NA,NA,NA,NA,NA,NA,NA,NA,10.1016/S0308-521X(00)00060-3,1,10.1016/S0308-521X(00)00060-3,doi,https://doi.org/10.1016/S0308-521X(00)00060-3,https://www.research.manchester.ac.uk/portal/en/publications/organic-farming-and-the-sustainability-of-agricultural-systems(afa5941e-7f0b-4684-a68b-96390c27d8c3).html,article,base,NA,oa_found
UP,borrow,10.1016/j.jenvman.2016.09.040,NA,NA,NA,NA,NA,NA,NA,NA,42680.17906365741,03014797,NA,ORZ,NA,NA,NA,NA,NA,NA,NA,NA,NA,NA,Horseradish peroxidase-assisted approach to decolorize and detoxify dye pollutants in a packed bed bioreactor,Journal of environmental management.,NA,In Press,2016,-0,"Bilal, Muhammad",NA,CAS:CAPLUS,NA,NA,NA,NA,NA,NA,NA,NA,NA,NA,10.1016/j.jenvman.2016.09.040,1,10.1016/j.jenvman.2016.09.040,doi,https://doi.org/10.1016/j.jenvman.2016.09.040,NA,NA,NA,NA,oa_not_found
UP,borrow,10.1039/A606765D,NA,NA,NA,NA,NA,NA,NA,NA,42584.20735991898,0300-922X,NA,web,NA,NA,NA,NA,NA,NA,NA,NA,NA,NA,Synthesis of the monomeric unit of γ-actinorhodin,"Journal of the Chemical Society, Perkin Transactions 1",NA,9,1997,1399-1403,NA,NA,CAS:CAPLUS,NA,NA,NA,NA,NA,NA,NA,NA,NA,NA,10.1039/A606765D,1,10.1039/A606765D,doi,https://doi.org/10.1039/A606765D,https://researchspace.auckland.ac.nz/handle/2292/8225,article,base,NA,oa_found
UP,borrow,10.1128/JVI.02202-16,NA,NA,NA,NA,NA,NA,NA,NA,42827.19426038194,NA,NA,ORZ,NA,NA,NA,NA,NA,NA,NA,NA,NA,NA,Zika Virus Methyltransferase: Structure and Functions for Drug Design Perspectives,Journal of virology.,91,5,2017,02202-16,NA,NA,NA,NA,NA,NA,NA,NA,NA,NA,NA,NA,NA,10.1128/JVI.02202-16,1,10.1128/JVI.02202-16,doi,https://doi.org/10.1128/JVI.02202-16,http://europepmc.org/backend/ptpmcrender.fcgi?accid=PMC5309936&blobtype=pdf,article,eupmc,NA,oa_found
UP,borrow,NA,NA,NA,NA,NA,NA,NA,NA,NA,42842.40611111111,NA,NA,MNT,NA,NA,NA,NA,NA,NA,NA,NA,NA,NA,The communion of saints in the final days of the Council of Trent,"The One Mediator, the saints, and Mary /",NA,NA,1992,219-,NA,NA,EBSCO:ATLA Religion Database with ATLASerials:ATLA0001204607,NA,NA,NA,NA,NA,NA,NA,NA,NA,NA,no doi,0,The communion of saints in the final days of the Council of Trent,title,TITLE:The communion of saints in the final days of the Council of Trent,NA,NA,NA,NA,oa_not_found
UP,borrow,10.1016/S0006-3207(98)00156-6,NA,NA,NA,NA,NA,NA,NA,NA,42827.19426114583,0006-3207,NA,rge,NA,NA,NA,NA,NA,NA,NA,NA,NA,NA,"Current distribution, status and conservation of wild red pandas Ailurus fulgens in China",Biological conservation,89,3,1999,285-,NA,NA,Elsevier:SD,NA,NA,NA,NA,NA,NA,NA,NA,NA,NA,10.1016/S0006-3207(98)00156-6,1,10.1016/S0006-3207(98)00156-6,doi,https://doi.org/10.1016/S0006-3207(98)00156-6,NA,NA,NA,NA,oa_not_found
UP,borrow,10.1021/bk-2013-1137.ch002,NA,NA,NA,NA,NA,NA,NA,NA,42915.43462199074,0097-6156,NA,NTD,NA,NA,NA,NA,NA,NA,NA,NA,NA,NA,Nontraditional Instructional Approaches to Undergraduate Student Learning of Spectroscopic Techniques for Bioanalysis,ACS symposium series.,1137,NA,2013,11-22,"Barnes, S L",NA,CAS:CAPLUS,NA,NA,NA,NA,NA,NA,NA,NA,NA,NA,10.1021/bk-2013-1137.ch002,1,10.1021/bk-2013-1137.ch002,doi,https://doi.org/10.1021/bk-2013-1137.ch002,NA,NA,NA,NA,oa_not_found
UP,borrow,NA,NA,NA,NA,NA,NA,NA,NA,NA,42851.20150991898,NA,NA,GFC,NA,NA,NA,NA,NA,NA,NA,NA,NA,NA,Ignatian process for discovering the will of God in an existential situation,"Ignatius of Loyola, his personality and spiritual heritage, 1556-1956 : studies on the 400th anniversary of his death /",NA,NA,1977,280-,"Wulf, Friedrich, 1908-",NA,EBSCO:ATLA Religion Database with ATLASerials:ATLA0001091749,NA,NA,NA,NA,NA,NA,NA,NA,NA,NA,no doi,0,Ignatian process for discovering the will of God in an existential situation,title,TITLE:Ignatian process for discovering the will of God in an existential situation,NA,NA,NA,NA,oa_not_found
UP,borrow,10.1016/j.jmpt.2009.10.005,NA,NA,NA,NA,NA,NA,NA,NA,42569.207290590275,0161-4754,NA,OOJ,NA,NA,NA,NA,NA,NA,NA,NA,NA,NA,The Difference Between Integration and Collaboration in Patient Care: Results From Key Informant Interviews Working in Multiprofessional Health Care Teams,Journal of manipulative and physiological therapeutics : JMPT.,32,9,2009,715-,NA,NA,Elsevier:SD,NA,NA,NA,NA,NA,NA,NA,NA,NA,NA,10.1016/j.jmpt.2009.10.005,1,10.1016/j.jmpt.2009.10.005,doi,https://doi.org/10.1016/j.jmpt.2009.10.005,https://www.ncbi.nlm.nih.gov/pmc/articles/PMC2828362/,article,base,NA,oa_found
UP,lending,10.1080/15283488.2014.989440,Navigating sexual and religious identity conflict: A Mormon perspective.,NA,NA,NA,NA,NA,"Dehlin, John P.;Galliher, Renee V.;Bradshaw, William S.;Crowell, Katherine A.",NA,NA,1532-706X 1528-3488,NA,NA,NA,NA,NA,NA,NA,NA,NA,NA,NA,NA,NA,Identity : an international journal of theory and research.,15,1,2015-01-01,1-22,NA,NA,NA,NA,NA,NA,NA,NA,NA,NA,NA,NA,NA,10.1080/15283488.2014.989440,1,10.1080/15283488.2014.989440,doi,https://doi.org/10.1080/15283488.2014.989440,https://digitalcommons.usu.edu/graduate_pubs/22/,article,base,NA,oa_found
UP,lending,10.1136/qshc.2008.028787,Applying root cause analysis to improve patient safety: decreasing falls in postpartum women.,NA,NA,NA,NA,NA,"Chen, K-H",NA,NA,1475-3901,NA,NA,NA,NA,NA,NA,NA,NA,NA,NA,NA,NA,NA,"PRIMUS : problems, resources, and issues in mathematics undergraduate studies.",19,2,2010,138-,NA,NA,NA,NA,NA,NA,NA,NA,NA,NA,NA,NA,NA,10.1136/qshc.2008.028787,1,10.1136/qshc.2008.028787,doi,https://doi.org/10.1136/qshc.2008.028787,NA,NA,NA,NA,oa_not_found
UP,lending,10.1353/cwe.2011.0081,Mapping the Spaces of Women's Civil War History,NA,NA,NA,NA,NA,Lyde Cullen Sizer,NA,NA,2159-9807,NA,NA,NA,NA,NA,NA,NA,NA,NA,NA,NA,NA,NA,Journal of the Civil War Era,1,4,2011,536-548,NA,NA,NA,NA,NA,NA,NA,NA,NA,NA,NA,NA,NA,10.1353/cwe.2011.0081,1,10.1353/cwe.2011.0081,doi,https://doi.org/10.1353/cwe.2011.0081,NA,NA,NA,NA,oa_not_found
UP,lending,NA,Erasure and Survival: Creating a Future and Managing a Past in a Restructuring High School,NA,NA,NA,NA,NA,"Columbia University Galletta, Anne",NA,NA,1467-9620; 0161-4681,NA,NA,NA,NA,NA,NA,NA,NA,NA,NA,NA,NA,NA,Teachers College Record,110,9,20080101,1959,NA,NA,NA,NA,NA,NA,NA,NA,NA,NA,NA,NA,NA,no doi,0,Erasure and Survival: Creating a Future and Managing a Past in a Restructuring High School,title,TITLE:Erasure and Survival: Creating a Future and Managing a Past in a Restructuring High School,NA,NA,NA,NA,oa_not_found
UP,lending,10.1016/j.annemergmed.2009.03.005,The association between transfer of emergency department boarders to inpatient hallways and mortality: a 4-year experience.,NA,NA,NA,NA,NA,NA,NA,NA,1097-6760,NA,NA,NA,NA,NA,NA,NA,NA,NA,NA,NA,NA,NA,Annal of emergency medicine,54,4,01 2009,487-,NA,NA,NA,NA,NA,NA,NA,NA,NA,NA,NA,NA,NA,10.1016/j.annemergmed.2009.03.005,1,10.1016/j.annemergmed.2009.03.005,doi,https://doi.org/10.1016/j.annemergmed.2009.03.005,NA,NA,NA,NA,oa_not_found
UP,lending,10.1093/rapstu/rav002,A credit spread puzzle for reduced form models,NA,NA,NA,NA,NA,"Society for Financial Studies; Oxford University Press Berndt, A.",NA,NA,2045-9939 2045-9920,NA,NA,NA,NA,NA,NA,NA,NA,NA,NA,NA,NA,NA,The Review of Asset Pricing Studies,5,1,2015,48-91,NA,NA,NA,NA,NA,NA,NA,NA,NA,NA,NA,NA,NA,10.1093/rapstu/rav002,1,10.1093/rapstu/rav002,doi,https://doi.org/10.1093/rapstu/rav002,https://academic.oup.com/raps/article-abstract/5/1/48/1915372?redirectedFrom=PDF,article,oadoi,NA,oa_found
UP,lending,10.1016/j.jaac.2017.01.013,"Child Abuse, Neural Structure, and Adolescent Psychopathology: A Longitudinal Study",NA,NA,NA,NA,NA,"Busso, Daniel S",NA,NA,1527-5418,NA,NA,NA,NA,NA,NA,NA,NA,NA,NA,NA,NA,NA,Journal of the American Academy of Child & Adolescent Psychiatry.,NA,NA,Feb 3 2017,online,NA,NA,NA,NA,NA,NA,NA,NA,NA,NA,NA,NA,NA,10.1016/j.jaac.2017.01.013,1,10.1016/j.jaac.2017.01.013,doi,https://doi.org/10.1016/j.jaac.2017.01.013,http://europepmc.org/backend/ptpmcrender.fcgi?accid=PMC5367472&blobtype=pdf,article,eupmc,NA,oa_found
UP,lending,10.1002/hrm.21768,"Oh, In-Sue,: Human Capital Factors Affecting Human Resource (HR) Managers' Commitment to HR and the Mediating Role of Perceived Organizational Value o",NA,NA,NA,NA,NA,NA,NA,NA,1099-050X,NA,NA,NA,NA,NA,NA,NA,NA,NA,NA,NA,NA,NA,Human resource management.,56,2,March-April 2017,353-368,NA,NA,NA,NA,NA,NA,NA,NA,NA,NA,NA,NA,NA,10.1002/hrm.21768,1,10.1002/hrm.21768,doi,https://doi.org/10.1002/hrm.21768,NA,NA,NA,NA,oa_not_found
UP,lending,10.1177/0956797613484937,Fear of Holes.,NA,NA,NA,NA,NA,NA,NA,NA,1467-9280,NA,NA,NA,NA,NA,NA,NA,NA,NA,NA,NA,NA,NA,Psychological Science,24,10,2013,1980-1985,NA,NA,NA,NA,NA,NA,NA,NA,NA,NA,NA,NA,NA,10.1177/0956797613484937,1,10.1177/0956797613484937,doi,https://doi.org/10.1177/0956797613484937,https://core.ac.uk/download/pdf/16470586.pdf,article,core,NA,oa_found
UP,lending,10.1176/foc.1.1.64,Practice guideline for the treatment of patients with bipolar disorder (revision).,NA,NA,NA,NA,NA,American Psychiatric Association.,NA,NA,1535-7228,NA,NA,NA,NA,NA,NA,NA,NA,NA,NA,NA,NA,NA,American Journal of Psychiatry,159,4 Suppl,2002,1-50,NA,NA,NA,NA,NA,NA,NA,NA,NA,NA,NA,NA,NA,10.1176/foc.1.1.64,1,10.1176/foc.1.1.64,doi,https://doi.org/10.1176/foc.1.1.64,NA,NA,NA,NA,oa_not_found
UP,lending,10.1080/01612840500280695,"Stigmatization of Hispanic children, pre-adolescents, and adolescents with mental illness: exploration using a national database.",NA,NA,NA,NA,NA,"Leal, Christina",NA,NA,1096-4673,NA,NA,NA,NA,NA,NA,NA,NA,NA,NA,NA,NA,NA,Issues in mental health nursing.,26,10,2005,1025-,NA,NA,NA,NA,NA,NA,NA,NA,NA,NA,NA,NA,NA,10.1080/01612840500280695,1,10.1080/01612840500280695,doi,https://doi.org/10.1080/01612840500280695,NA,NA,NA,NA,oa_not_found
UP,lending,10.1097/ANC.0b013e318285fb5b,Implementing family-integrated care in the NICU: a parent education and support program.,NA,NA,NA,NA,NA,"Bracht, Marianne",NA,NA,1536-0911,NA,NA,NA,NA,NA,NA,NA,NA,NA,NA,NA,NA,NA,Advances in neonatal care : official journal of the National Association of Neonatal Nurses.,13,2,4 2013,115-26,NA,NA,NA,NA,NA,NA,NA,NA,NA,NA,NA,NA,NA,10.1097/ANC.0b013e318285fb5b,1,10.1097/ANC.0b013e318285fb5b,doi,https://doi.org/10.1097/ANC.0b013e318285fb5b,NA,NA,NA,NA,oa_not_found
UP,lending,NA,Culturally competent teaching strategies for Asian nursing students for whom English is a second language.,NA,NA,NA,NA,NA,"Kataoka-Yahiro MR,",NA,NA,1071-5568,NA,NA,NA,NA,NA,NA,NA,NA,NA,NA,NA,NA,NA,Journal of cultural diversity,4,3,9 1997,83-87,NA,NA,NA,NA,NA,NA,NA,NA,NA,NA,NA,NA,NA,no doi,0,Culturally competent teaching strategies for Asian nursing students for whom English is a second language.,title,TITLE:Culturally competent teaching strategies for Asian nursing students for whom English is a second language.,NA,NA,NA,NA,oa_not_found
UP,lending,NA,A Multipolar World and Russian Foreign Policy.,NA,NA,NA,NA,NA,"Dugin, A",NA,NA,0130-9641,NA,NA,NA,NA,NA,NA,NA,NA,NA,NA,NA,NA,NA,International affairs.,58,6,2012,141-145,NA,NA,NA,NA,NA,NA,NA,NA,NA,NA,NA,NA,NA,no doi,0,A Multipolar World and Russian Foreign Policy.,title,TITLE:A Multipolar World and Russian Foreign Policy.,NA,NA,NA,NA,oa_not_found
UP,lending,10.1111/irel.12166,the labor-market impact of san francisco's employer-benefit mandate,NA,NA,NA,NA,NA,"University of California, Berkeley colla, carrie h.",NA,NA,0019-8676 1468-232X,NA,NA,NA,NA,NA,NA,NA,NA,NA,NA,NA,NA,NA,Industrial relations,56,1,jan 2017,122-160,NA,NA,NA,NA,NA,NA,NA,NA,NA,NA,NA,NA,NA,10.1111/irel.12166,1,10.1111/irel.12166,doi,https://doi.org/10.1111/irel.12166,https://onlinelibrary.wiley.com/doi/pdf/10.1111/irel.12166,article,oadoi,NA,oa_found
UP,lending,10.5840/acpaproc2008824,The Ethics of Honour and the Possibility of Promise,NA,NA,NA,NA,NA,NA,NA,NA,0065-7638,NA,NA,NA,NA,NA,NA,NA,NA,NA,NA,NA,NA,NA,Proceedings of the American Catholic Philosophical Association,82,NA,2008,31-,NA,NA,NA,NA,NA,NA,NA,NA,NA,NA,NA,NA,NA,10.5840/acpaproc2008824,1,10.5840/acpaproc2008824,doi,https://doi.org/10.5840/acpaproc2008824,http://europepmc.org/backend/ptpmcrender.fcgi?accid=PMC6020015&blobtype=pdf,article,eupmc,NA,oa_found
UP,lending,10.1080/00071773.2003.11007395,Merleau-Ponty and the other World of Painting,NA,NA,NA,NA,NA,"Larsen, Tarjei Mandt",NA,NA,0007-1773,NA,NA,NA,NA,NA,NA,NA,NA,NA,NA,NA,NA,NA,Journal of the British Society for Phenomenology,34,1,2003,45-56,NA,NA,NA,NA,NA,NA,NA,NA,NA,NA,NA,NA,NA,10.1080/00071773.2003.11007395,1,10.1080/00071773.2003.11007395,doi,https://doi.org/10.1080/00071773.2003.11007395,NA,NA,NA,NA,oa_not_found
UP,lending,10.1542/peds.2006-3448,Fetal Down syndrome brains exhibit aberrant levels of neurotransmitters critical for normal brain development.,NA,NA,NA,NA,NA,American Academy of Pediatrics Whittle N,NA,NA,1098-4275 0031-4005,NA,NA,NA,NA,NA,NA,NA,NA,NA,NA,NA,NA,NA,Pediatrics,120,6,2007-12-01,e1465-71,NA,NA,NA,NA,NA,NA,NA,NA,NA,NA,NA,NA,NA,10.1542/peds.2006-3448,1,10.1542/peds.2006-3448,doi,https://doi.org/10.1542/peds.2006-3448,NA,NA,NA,NA,oa_not_found
UP,lending,NA,Drug Violence Isn't Mexico's Only Problem,NA,NA,NA,NA,NA,"Gonzlez, Francisco,",NA,NA,1944-785X,NA,NA,NA,NA,NA,NA,NA,NA,NA,NA,NA,NA,NA,Current history.,110,733,2 2011,68-,NA,NA,NA,NA,NA,NA,NA,NA,NA,NA,NA,NA,NA,no doi,0,Drug Violence Isn't Mexico's Only Problem,title,TITLE:Drug Violence Isn't Mexico's Only Problem,NA,NA,NA,NA,oa_not_found
UP,lending,10.1177/2156587211428076,"Fluoride: Its Metabolism, Toxicity, and Role in Dental Health",NA,NA,NA,NA,NA,"Martínez-Mier, E. Angeles",NA,NA,2156-5899 2156-5872,NA,NA,NA,NA,NA,NA,NA,NA,NA,NA,NA,NA,NA,Journal of evidence-based integrative medivine,17,1,2012-01-01,28-32,NA,NA,NA,NA,NA,NA,NA,NA,NA,NA,NA,NA,NA,10.1177/2156587211428076,1,10.1177/2156587211428076,doi,https://doi.org/10.1177/2156587211428076,NA,NA,NA,NA,oa_not_found
UP,lending,10.1177/1049909114524475,What Consumers Want to Know About Quality When Choosing a Hospice Provider. American Journal of Hospice and Palliative Medicine,NA,NA,NA,NA,NA,"Smith, B., McDuff, J., Naierman, N., Kreling, B., Tein, N., Hunter, D., ... & Lynn, J.",NA,NA,1938-2715,NA,NA,NA,NA,NA,NA,NA,NA,NA,NA,NA,NA,NA,American journal of hospice and palliative medicine,32,4,2015,393-400.,NA,NA,NA,NA,NA,NA,NA,NA,NA,NA,NA,NA,NA,10.1177/1049909114524475,1,10.1177/1049909114524475,doi,https://doi.org/10.1177/1049909114524475,NA,NA,NA,NA,oa_not_found
UP,lending,10.1097/MCO.0000000000000325,Overview on nutritional issues in bariatric surgery.,NA,NA,NA,NA,NA,NA,NA,NA,1473-6519,NA,NA,NA,NA,NA,NA,NA,NA,NA,NA,NA,NA,NA,Current opinion in clinical nutrition and metabolic care.,19,6,01 2016,484-,NA,NA,NA,NA,NA,NA,NA,NA,NA,NA,NA,NA,NA,10.1097/MCO.0000000000000325,1,10.1097/MCO.0000000000000325,doi,https://doi.org/10.1097/MCO.0000000000000325,https://hal-univ-rennes1.archives-ouvertes.fr/hal-01427012,article,base,NA,oa_found
UP,lending,NA,A Feminist Perspective of Virginia Woolfs Selected Novels: Mrs. Dalloway and To the Lighthouse,NA,NA,NA,NA,NA,"Shihada, Isam M",NA,NA,1680-0982,NA,NA,NA,NA,NA,NA,NA,NA,NA,NA,NA,NA,NA,SSRN,6,NA,2005,15-34,NA,NA,NA,NA,NA,NA,NA,NA,NA,NA,NA,NA,NA,https://www.alaqsa.edu.ps/site_resources/aqsa_magazine/files/44.pdf,0,A Feminist Perspective of Virginia Woolfs Selected Novels: Mrs. Dalloway and To the Lighthouse,title,TITLE:A Feminist Perspective of Virginia Woolfs Selected Novels: Mrs. Dalloway and To the Lighthouse,NA,NA,NA,NA,oa_not_found
UP,lending,10.1080/10510978009368054,"American Political Rhetoric and the Jeremiad Tradition: Presidential Nomination Acceptance Addresses, 1960-1976",NA,NA,NA,NA,NA,"Ritter, Kurt W.,",NA,NA,0008-9575,NA,NA,NA,NA,NA,NA,NA,NA,NA,NA,NA,NA,NA,Central states speech journal.,31,NA,1980,153-171,NA,NA,NA,NA,NA,NA,NA,NA,NA,NA,NA,NA,NA,10.1080/10510978009368054,1,10.1080/10510978009368054,doi,https://doi.org/10.1080/10510978009368054,NA,NA,NA,NA,oa_not_found
UP,lending,10.1016/j.jamda.2015.08.016,Effects of Physical Exercise on Health and Well-Being of Individuals Living With a Dementia in Nursing Homes: A Systematic Review,NA,NA,NA,NA,NA,"Brett, Lindsey,",NA,NA,1538-9375,NA,NA,NA,NA,NA,NA,NA,NA,NA,NA,NA,NA,NA,Journal of post-acute and long-term care medicine,17,2,2016,104-,NA,NA,NA,NA,NA,NA,NA,NA,NA,NA,NA,NA,NA,10.1016/j.jamda.2015.08.016,1,10.1016/j.jamda.2015.08.016,doi,https://doi.org/10.1016/j.jamda.2015.08.016,http://ro.uow.edu.au/cgi/viewcontent.cgi?article=4573&context=smhpapers,article,oadoi,NA,oa_found
UP,lending,10.1080/10573560490264134,The interaction of reading skills and science content knowledge when teaching struggling secondary students,NA,NA,NA,NA,NA,"Carnine, L. and Carnine D",NA,NA,1521-0693 1057-3569,NA,NA,NA,NA,NA,NA,NA,NA,NA,NA,NA,NA,NA,Reading and writing quarterly.,20,NA,2004,203-218,NA,NA,NA,NA,NA,NA,NA,NA,NA,NA,NA,NA,NA,10.1080/10573560490264134,1,10.1080/10573560490264134,doi,https://doi.org/10.1080/10573560490264134,NA,NA,NA,NA,oa_not_found
UP,lending,10.1016/j.cnc.2015.08.003,Hypertensive Crisis: A Review of Pathophysiology and Treatment.,NA,NA,NA,NA,NA,"Taylor, Deborah A",NA,NA,0899-5885,NA,NA,NA,NA,NA,NA,NA,NA,NA,NA,NA,NA,NA,Critical care nursing clinics of North America.,27,4,01 2015,439-447,NA,NA,NA,NA,NA,NA,NA,NA,NA,NA,NA,NA,NA,10.1016/j.cnc.2015.08.003,1,10.1016/j.cnc.2015.08.003,doi,https://doi.org/10.1016/j.cnc.2015.08.003,http://www.safpj.co.za/index.php/safpj/article/view/1796,article,BASE,NA,oa_found
UP,lending,10.1016/j.jand.2016.03.014,Availability of Foods and Beverages in Supplemental Nutrition Assistance Program−Authorized Dollar Stores in a Region of North Carolina.,NA,NA,NA,NA,NA,"Academy of Nutrition and Dietetics Racine, Elizabeth F.; Batada, Ameena; Solomon, Corliss A.; Story,",NA,NA,2212-2680 2212-2672,NA,NA,NA,NA,NA,NA,NA,NA,NA,NA,NA,NA,NA,Journal of the academy of Nutrition and Dietetics.,116,10,2016,1613-1620,NA,NA,NA,NA,NA,NA,NA,NA,NA,NA,NA,NA,NA,10.1016/j.jand.2016.03.014,1,10.1016/j.jand.2016.03.014,doi,https://doi.org/10.1016/j.jand.2016.03.014,NA,NA,NA,NA,oa_not_found
UP,lending,10.1016/j.jand.2013.06.316,Vegetarians and Vegans: Are They at Increased Risk for Disordered Eating and Poor Psychological Well-Being?...Insights to Action. Academy of Nutrition,NA,NA,NA,NA,NA,Academy of Nutrition and Dietetics V. Quick,NA,NA,2212-2680 2212-2672,NA,NA,NA,NA,NA,NA,NA,NA,NA,NA,NA,NA,NA,Journal of the academy of Nutrition and Dietetics.,113,NA,2013,A89,NA,NA,NA,NA,NA,NA,NA,NA,NA,NA,NA,NA,NA,10.1016/j.jand.2013.06.316,1,10.1016/j.jand.2013.06.316,doi,https://doi.org/10.1016/j.jand.2013.06.316,NA,NA,NA,NA,oa_not_found
UP,lending,10.1111/acem.13073,Cognitive rest and graduated return to usual activities versus usual care for mild traumatic brain injury: A randomized controlled trial of emergency,NA,NA,NA,NA,NA,"Varner, Catherine E",NA,NA,1553-2712,NA,NA,NA,NA,NA,NA,NA,NA,NA,NA,NA,NA,NA,Academic emergency medicine.,epub,NA,01 2016,-,NA,NA,NA,NA,NA,NA,NA,NA,NA,NA,NA,NA,NA,10.1111/acem.13073,1,10.1111/acem.13073,doi,https://doi.org/10.1111/acem.13073,https://onlinelibrary.wiley.com/doi/pdf/10.1111/acem.13073,article,oadoi,NA,oa_found
UP,lending,10.1177/1078390312439469,A change in culture: violence prevention in an acute behavioral health setting,NA,NA,NA,NA,NA,"Goetz, Suzanne Barnum",NA,NA,1532-5725,NA,NA,NA,NA,NA,NA,NA,NA,NA,NA,NA,NA,NA,Journal of the American psychiatric Nurses Association.,18,2,2012,96-,NA,NA,NA,NA,NA,NA,NA,NA,NA,NA,NA,NA,NA,10.1177/1078390312439469,1,10.1177/1078390312439469,doi,https://doi.org/10.1177/1078390312439469,NA,NA,NA,NA,oa_not_found
UP,lending,10.1097/PEP.0000000000000227,Modified Constraint-Induced Movement Therapy as a Home-Based Intervention for Children With Cerebral Palsy.,NA,NA,NA,NA,NA,"Psychouli, Pavlina",NA,NA,1538-005X,NA,NA,NA,NA,NA,NA,NA,NA,NA,NA,NA,NA,NA,Pediatric physical therapy : the official journal of the Section on Pediatrics of the American Physical Therapy Association.,28,2,2016,154-160,NA,NA,NA,NA,NA,NA,NA,NA,NA,NA,NA,NA,NA,10.1097/PEP.0000000000000227,1,10.1097/PEP.0000000000000227,doi,https://doi.org/10.1097/PEP.0000000000000227,https://eprints.soton.ac.uk/400190/,article,base,NA,oa_found
UP,lending,10.1146/annurev-publhealth-031914-122957,The prescription opioid and heroin crisis: a public health approach to an epidemic of addiction.,NA,NA,NA,NA,NA,"Kolodny, Andrew,",NA,NA,0163-7525,NA,NA,NA,NA,NA,NA,NA,NA,NA,NA,NA,NA,NA,Annual review of public health.,36,1,2015-03-18,559-574,NA,NA,NA,NA,NA,NA,NA,NA,NA,NA,NA,NA,NA,10.1146/annurev-publhealth-031914-122957,1,10.1146/annurev-publhealth-031914-122957,doi,https://doi.org/10.1146/annurev-publhealth-031914-122957,https://www.annualreviews.org/doi/pdf/10.1146/annurev-publhealth-031914-122957,article,oadoi,NA,oa_found
UP,lending,10.1111/jonm.12381,Nurse leader certification preparation: how are confidence levels impacted?,NA,NA,NA,NA,NA,"Junger S,",NA,NA,1365-2834,NA,NA,NA,NA,NA,NA,NA,NA,NA,NA,NA,NA,NA,Journal of nursing management.,epub ahead of print,NA,2016,epub ahead of print,NA,NA,NA,NA,NA,NA,NA,NA,NA,NA,NA,NA,NA,10.1111/jonm.12381,1,10.1111/jonm.12381,doi,https://doi.org/10.1111/jonm.12381,NA,NA,NA,NA,oa_not_found
UP,lending,10.1097/00004583-200107000-00019,Psychosocial and risk behavior correlates of youth suicide attempts and suicidal ideation.,NA,NA,NA,NA,NA,"American Academy of Child and Adolescent Psychiatry King, R. A., Schwab-Stone, M., Flisher, A. J., G",NA,NA,1527-5418 0890-8567,NA,NA,NA,NA,NA,NA,NA,NA,NA,NA,NA,NA,NA,Journal of the american academy of Child & Adolescent Psychiatry.,40,NA,2001,837-846,NA,NA,NA,NA,NA,NA,NA,NA,NA,NA,NA,NA,NA,10.1097/00004583-200107000-00019,1,10.1097/00004583-200107000-00019,doi,https://doi.org/10.1097/00004583-200107000-00019,NA,NA,NA,NA,oa_not_found
UP,lending,10.1177/0265407515574463,Sarah Watkins 'Expectations regarding partner fidelity in dating relationships',NA,NA,NA,NA,NA,International Association for Relationship Research,NA,NA,1460-3608; 0265-4075,NA,NA,NA,NA,NA,NA,NA,NA,NA,NA,NA,NA,NA,Journal of social and personal relationships,33,2,2016-03-01,237-256,NA,NA,NA,NA,NA,NA,NA,NA,NA,NA,NA,NA,NA,10.1177/0265407515574463,1,10.1177/0265407515574463,doi,https://doi.org/10.1177/0265407515574463,NA,NA,NA,NA,oa_not_found
UP,lending,10.1097/TGR.0000000000000111,Sexual Function After Stroke.,NA,NA,NA,NA,NA,"Thomas, Heather,",NA,NA,1550-2414,NA,NA,NA,NA,NA,NA,NA,NA,NA,NA,NA,NA,NA,Topics in geriatric rehabilitation,32,3,2016,204-209,NA,NA,NA,NA,NA,NA,NA,NA,NA,NA,NA,NA,NA,10.1097/TGR.0000000000000111,1,10.1097/TGR.0000000000000111,doi,https://doi.org/10.1097/TGR.0000000000000111,NA,NA,NA,NA,oa_not_found
UP,lending,10.1111/j.1547-5069.1999.tb00510.x,A Model for Change to Evidence-Based Practice,NA,NA,NA,NA,NA,"Rosswurm, Mary Ann,",NA,NA,0743-5150,NA,NA,NA,NA,NA,NA,NA,NA,NA,NA,NA,NA,NA,Journal of nursing scholarship,31,4,1999,NA,NA,NA,NA,NA,NA,NA,NA,NA,NA,NA,NA,NA,NA,10.1111/j.1547-5069.1999.tb00510.x,1,10.1111/j.1547-5069.1999.tb00510.x,doi,https://doi.org/10.1111/j.1547-5069.1999.tb00510.x,NA,NA,NA,NA,oa_not_found
UP,lending,10.1111/j.1468-2958.1975.tb00258.x,Some Explorations in Initial Interaction and Beyond: Toward a Theory of Interpersonal Communication,NA,NA,NA,NA,NA,"International Communication Association Berger, Charles R.;Calabrese, Richard J.",NA,NA,1468-2958 0360-3989,NA,NA,NA,NA,NA,NA,NA,NA,NA,NA,NA,NA,NA,Human communication research,1,2,1975,99-112,NA,NA,NA,NA,NA,NA,NA,NA,NA,NA,NA,NA,NA,10.1111/j.1468-2958.1975.tb00258.x,1,10.1111/j.1468-2958.1975.tb00258.x,doi,https://doi.org/10.1111/j.1468-2958.1975.tb00258.x,NA,NA,NA,NA,oa_not_found
